Date / Time,City,State,Country,Shape,Duration,Summary,Posted,Images
4/30/20 00:00,Thibodaux,LA,USA,Light,5,"14 Objects in a row, one behind each other and watch one by one disappear. ((Starlink satellites?))",6/25/20,
4/30/20 23:49,Saint Petersburg,FL,USA,Other,7 minutes,There were three dots in a straight line slowly moving for a while then boom vanish!,6/25/20,
4/30/20 22:43,Edgewood,WA,USA,Unknown,15-20 seconds,"Location of sighting: Edgewood, WA Date: Thursday April 30th Time: 10:43 PM Weather conditions: clear and other stars visible On Thurs",6/25/20,
4/30/20 22:30,Vergas,MN,USA,Light,>2 hours,White moving light. ((NUFORC Note: Venus?? PD)),6/25/20,
4/30/20 22:00,Jacksonville,FL,USA,Light,5 minutes,"Looked like stars, could have been satellites, but 50? ((Starlink satellites?))",6/25/20,
4/30/20 22:00,Tavares,FL,USA,Formation,5 minutes,Fast moving formation of 20+ objects flying 2 abreast. ((Starlink satellites?)),6/25/20,
4/30/20 22:00,Lincoln,AL,USA,Other,10-15 minutes,Lights moving across the night sky. ((Starlink satellites?)),6/25/20,
4/30/20 22:00,Calgary (Canada),AB,Canada,Disk,<5 minutes,"At approximately 10:00pm, I spotted a large white light in the sky, it was very bright. I went outside to inspect it further and the li",6/25/20,
4/30/20 21:43,Miami,FL,USA,Unknown,00:15,Hovering bright light,6/25/20,
4/30/20 21:35,Montverde,FL,USA,Unknown,5 Minutes,West to East was a straight line of what appeared to be air craft of some sort. ((Starlink satellites?)),6/25/20,
4/30/20 21:30,Davie,FL,USA,Formation,3:00 Minutes,6 craft line formation over south Florida. ((Starlink satellites?)),6/25/20,
4/30/20 21:30,Redmond,WA,USA,Light,20 minutes,long string of moving lights. ((Starlink satellites?)),6/25/20,
4/30/20 21:30,Jacksonville,FL,USA,Light,2 minutes,There were 10-20 Star-like figures gliding across the sky in unison. ((Starlink satellites?)),6/25/20,
4/30/20 21:25,St. Cloud,FL,USA,Formation,5 to 10 minutes,Just outside and looked at the sky and there was a line of UFOs about 15 to 20 objects. ((Starlink satellites?)),6/25/20,
4/30/20 21:25,Jacksonville,FL,USA,Unknown,2 minutes,Lights moving astronomically fast around the sky they stopped moving and stood still for about 15 seconds and then zoomed off,6/25/20,
4/30/20 21:23,Tampa,FL,USA,Circle,5 min maybe,Atleast 20 circular objects flying in a straight line at the same speed. ((Starlink satellites?)),6/25/20,
4/30/20 21:20,Jupiter,FL,USA,Formation,5 minutes,string of lights. ((Starlink satellites?)),6/25/20,
4/30/20 21:20,Honolulu,HI,USA,Unknown,1 minute,I was shootimg darts in my carport and saw a military helicopter flyer way faster than usual. As it get closer to land i niticed a wh,6/25/20,
4/30/20 21:20,Deland,FL,USA,Light,5 minutes,there was A-line of lights moving a cross the sky. They were moving North to South. ((Starlink satellites?)),6/25/20,
4/30/20 21:15,Fort Myers,FL,USA,Rectangle,1 minute,"A line of line of lights 7 in front, 5 in the middle, and another 6 or 7 in front. ((Starlink satellites?))",6/25/20,
4/30/20 21:15,New Smyrna Beach,FL,USA,Light,20 seconds,Numerous lights flying across the sky in a straight line and equidistant. ((Starlink satellites?)),6/25/20,
4/30/20 21:15,Coral Springs,FL,USA,Light,3:00,It was a consistent line of moving lights evenly spaced. ((Starlink satellites?)),6/25/20,
4/30/20 21:15,Brooksville,FL,USA,Light,10,"Long string of 24+ equally spaced lights moving across the sky from North to South in Brooksville, FL.",6/25/20,
4/30/20 21:15,Coconut Creek,FL,USA,Formation,Less than a minute,Dots of light in a line formation slowly moved in a southwest upward motion and each disappeared as it looked to be going upward.,6/25/20,
4/30/20 21:10,Saint Augustine,FL,USA,Light,5 minutes,20 plus lights in single file. About 5 minutes viewing. Last 2 lights were side by side. ((Starlink satellites?)),6/25/20,
4/30/20 21:09,Des Moines,IA,USA,Disk,2 minutes,hovering saucer nears ground then disappears in sky,6/25/20,
4/30/20 21:05,Titusville,FL,USA,Light,12 minutes,Objects look like stars but moving fast in one line. ((Starlink satellites?)),6/25/20,
4/30/20 21:00,Ocala,FL,USA,Light,Varied,I went out to smoke i always watch the sky when i seen 6 white lights high in the sky flying 2x2 with 1 in the front lasted for about 1,6/25/20,
4/30/20 21:00,Dover,FL,USA,Light,5 minutes,String of lights in Tampa Bay area.. ((Starlink satellites?)),6/25/20,
4/30/20 21:00,Seabrook,TX,USA,Formation,2 minutes,19 fast flying silent UFOs in formation. ((Starlink satellites?)),6/25/20,
4/30/20 21:00,Palm Bay,FL,USA,Light,5 minutes,15 plus lights traveling in perfect straight line. Appeared as bright as a star.,6/25/20,
4/30/20 21:00,Coral Gables,FL,USA,Light,5 min,"A couple stopped me and told me ""Am I crazy or those lights are moving? ((Starlink satellites?))",6/25/20,
4/30/20 20:50,Baton Rouge,LA,USA,Formation,5 minutes,Line of light moving across the sky. ((Starlink satellites?)),6/25/20,
4/30/20 20:15,Clermont,FL,USA,Cigar,5 Minutes,I saw 20+ bright lights cross the sky to the West below the moon. ((Starlink satellites?)),6/25/20,
4/30/20 20:10,Truth or Consequences,NM,USA,Circle,10 seconds,Was visible to the north. Two large circular red lights. Moved from east to west. Both lights appeared and then they moved west one ov,6/25/20,
4/30/20 19:50,Roseburg,OR,USA,Oval,5 minutes,"We were driving and had to pull over, craft was moving slowly, was as white as light, we watched it zig zag slowly and then disappear o",6/25/20,
4/30/20 19:00,Pleasant view,UT,USA,Sphere,60 seconds,My girlfriend and I were hammocking in my back yard when we saw something we first thought was a weather ballon then changes shape into,6/25/20,
4/30/20 17:00,Micco,FL,USA,Light,5:00,"10-12 objects flying or moving symmetrically, moving south! All objects looked like stars! ((Starlink satellites?))",6/25/20,
4/30/20 17:00,Vancouver,WA,USA,Circle,5 minutes,"Saw 'white orb swarm' of 10-20 during the day, near Columbia River in Vancouver, WA on 4/30/20.",6/25/20,
4/30/20 14:30,American Fork,UT,USA,Changing,3 minutes,Stationary bright silver object hovering over mountain then vanished out of sight.,6/25/20,
4/30/20 14:22,American Utah,UT,USA,Light,3 minutes,Picture of the same UFO that they filmed at Skinwalker Ranch.,6/25/20,
4/30/20 13:13,Cottonwood Heights,UT,USA,,30 seconds,Hill AFB just did the Covid flyby to support our first responders. Took this picture on Ft. Union Blvd. looks like a foo fighter above.,5/7/20,
4/30/20 11:30,San Diego,CA,USA,Formation,5 minutes,Three objects in exact formation,6/25/20,
4/30/20 09:17,Orlando,FL,USA,Circle,3 minutes,There was circular lights flying in a straight line crossing the moon. ((Starlink satellites?)),6/25/20,
4/30/20 09:17,Davie,FL,USA,Light,3 minutes,Backyard UFO Fleet night sky sighting! ((Starlink satellites?)),6/25/20,
4/30/20 09:14,Tifton,GA,USA,Light,3 minutes,30+ dots of light flying ons behind the other in a straight line heading south east. ((Starlink satellites?)),6/25/20,
4/30/20 03:28,Boise,ID,USA,,,MADAR Node 111,6/25/20,
4/30/20 03:15,Clearwater,FL,USA,Other,30 minutes,Got up to 3:15am was attracted to look at a star like that suddenly went to a blinding bright envelope of bright light.,6/25/20,
4/30/20 02:30,Bloomington,IL,USA,Light,15 minutes,Spotted an indigo light to the east of the city. encounter lasted roughtly 15 minutes.,6/25/20,
4/30/20 00:11,El Paso,TX,USA,Unknown,10 seconds,"It was around 12:11 in the morning and I was just hanging out in my backyard with my dog. I saw an object flying very low, around 100 o",6/25/20,
4/30/20 00:11,Pueblo,CO,USA,,,MADAR Node 83,6/25/20,
4/30/20,Pompano Beach,FL,USA,Oval,10 minutes,I was looking to the West and all of a sudden by I think the planet Venus??? There was 12 lights flying parallel in a straight line for,6/25/20,
4/29/20 23:55,Tulsa,OK,USA,Circle,7seconds,Object appeared Southwest moving very very quick to the northeast. After the object made it a ways to the northeast it turn quite abrup,6/25/20,
4/29/20 23:35,Banning,CA,USA,Light,5 min,Driving down a dark road we spotted a helicopter chasing a light at high speeds,6/25/20,
4/29/20 23:20,Citrus Heights,CA,USA,Light,5 minutes,2 star objects appear then disappear while moving vertical into the sky.,6/25/20,
4/29/20 23:00,Midland,TX,USA,Sphere,10 minutes,Second sighting in 1 week. Strait line. Very high speed. Side observer also in sphere. Moving over 7.500 MPH. Saw by neighbor and us. S,6/25/20,
4/29/20 22:30,Kelowna (Canada),BC,Canada,Cone,15 minutes,Space station like object looks like its continuously on a loop only seeing one object at a time 10 of them. ((Starlink satellites?)),6/25/20,
4/29/20 22:00,Fort Jones,CA,USA,Light,1-2 hours,First noticed a very bright light hovering in the sky. Then noticed some star like lights moving. ((Starlink satellites?)),6/25/20,
4/29/20 22:00,Cape Coral,FL,USA,Light,30 minutes,"Light moving sporadically over SW Florida coast. ((NUFORC Note: We suspect either Venus, or Sirius. PD))",6/25/20,
4/29/20 22:00,Fort Jones,CA,USA,Light,1-2 hours,"Multiple ""star"" like lights moving throughout night sky, then ascending into sky. ((Starlink satellites?))",6/25/20,
4/29/20 21:40,Port Saint Lucie,FL,USA,Oval,30 seconds,Several lights in a straight line and then disappearing above the stars. ((Starlink satellites?)),6/25/20,
4/29/20 21:40,Geneva,FL,USA,Light,5 Minutes,We saw 50+ dots of light traveling in perfect unison one after the othe. ((Starlink satellites?)),6/25/20,
4/29/20 21:30,Woodbury,GA,USA,Light,10 minutes,String of tiny lights in sky approx. 50 to 75 in single file straight line extremely high up. ((Starlink satellites?)),6/25/20,
4/29/20 21:30,Vero Beach,FL,USA,Light,10 minutes,While fishing on the Indian River near Johns island 30-40 lights were observed heading N to S. ((Starlink satellites?)),6/25/20,
4/29/20 21:30,Salem,OR,USA,Light,,"My mom woke me up around 9:30 ish and told me to ""come look at this ufo hurry."" Went outside and it looked like a super brigh",6/25/20,
4/29/20 21:25,Mount Pleasant,SC,USA,Formation,20 seconds,We saw 6 lighted objects moving in a straight line towards a dimmer light and then disappeared.,6/25/20,
4/29/20 21:25,Los Angeles,CA,USA,Fireball,10-15 seconds,"Bright, orange/reddish light spotted moving over East LA",6/25/20,
4/29/20 21:15,Ponte Vedra Beach,FL,USA,Light,5 minutes,Fleet of 30 crafts traveling in a row. ((Starlink satellites?)),6/25/20,
4/29/20 21:00,Birmingham,AL,USA,Circle,Night,About 20 Craftsin the sky moving at a fast rate in a single filed line. ((Starlink satellites??)),6/25/20,
4/29/20 20:45,Richmond,TX,USA,Diamond,2 minutes,i noticed a straight line of stars i thought then i noticed they were moving in perfect formation. ((Starlink satellites?)),6/25/20,
4/29/20 20:40,Murfreesboro,TN,USA,Formation,5 minutes,Straight line formation of 30 objects. ((Starlink satellites?)),6/25/20,
4/29/20 20:35,Waynesboro,TN,USA,Unknown,3 minutes,I saw a fast moving star light object and small sized object moving rapidly across the sky. ((Starlink satellites?)),6/25/20,
4/29/20 19:18,Melbourne,FL,USA,Light,4 minutes,Line of traveling white lights disappear one by one over Melbourne FL.,6/25/20,
4/29/20 18:34,Fayetteville,AR,USA,,,MADAR Node 136,6/25/20,
4/29/20 16:45,Holt,FL,USA,Rectangle,45 seconds,Witnessed oblong metallic object sit motionless in sky for 30 seconds before slowly flying away.,6/25/20,
4/29/20 16:00,Tacoma,WA,USA,Diamond,1 hour,See a whole fleet of UFO's all flying in a straight line. ((Starlink satellites?)),6/25/20,
4/29/20 09:45,West Jordan,UT,USA,Cylinder,30 minutes,I was walking northbound and observed a white light (much like Venus in brightness) slowly travelli g both and a very slowly speed. I g,6/25/20,
4/29/20 06:00,Covington,KY,USA,Circle,1 minute,2 spheres about a foot apart colliding together and back apart.,6/25/20,
4/29/20 04:15,Frostproof,FL,USA,Light,3 seconds,I saw a very bright very green light descend over Lake Clinch.,6/25/20,
4/29/20 03:18,Santa Fe,NM,USA,,,MADAR Node 78,6/25/20,
4/29/20 00:45,Carson City,NV,USA,Sphere,20 minutes,Bright Object jumping back and forth in sky followed by 3 star like diagonally lined object hovering in the sky.,6/25/20,
4/29/20 00:30,Ewa Beach,HI,USA,Light,2 seconds,"White light, with orange trails on each side.",6/25/20,
4/28/20 00:00,Hammonton,NJ,USA,Formation,South Jersey,they travel very fast in single line in the sky traveling from the west. ((Starlink satellites?)),6/25/20,
4/28/20 23:20,Trafalgar,IN,USA,Circle,45 sec,Helicopter chasing red large round object in the sky.,6/25/20,
4/28/20 23:15,Courtenay (Canada),BC,Canada,Light,15 minutes,"I watched them go by, they seem to be approximately the same distance apart. In a line. T ((Starlink satellites?))",6/25/20,
4/28/20 23:00,Kearney,NE,USA,Triangle,5 minutes,After sunset 2 large UFOs flying away,9/9/22,
4/28/20 23:00,Yerevan (Armenia),,Armenia,Triangle,1 minute,"3 red dot lights keeping their triangle shape and spinning in circles, i saw this while i was smoking outside on my balcony,my apartmen",6/25/20,
4/28/20 22:10,Wilmington,NC,USA,Unknown,5 minutes,"10 white lights in formation, observed over Wilmington NC. ((Starlink satellites?))",6/25/20,
4/28/20 22:00,Belton,SC,USA,Circle,5 minutes,We saw (what I counted) 12 round orbs following one another at an exact distance from one another ((Starlink satellites??)),6/25/20,
4/28/20 22:00,Millington,TN,USA,Light,More than 30 minutes,"Bright singular light hovering, disappearing, then reappearing in minutes",6/25/20,
4/28/20 22:00,Taylors,SC,USA,Formation,5 minutes,String of lights formation. Traveling west to east. ((Starlink satellites?)),6/25/20,
4/28/20 21:58,Iowa Park,TX,USA,Light,4 minutes,It looked like a string of white lights evenly spaced apart. ((Starlink satellites?)),6/25/20,
4/28/20 21:49,Kamay,TX,USA,Light,1.5 minutes,I saw a line of about 8 to 10 star-like looking objects. They were moving in an upward angle towards south. ((Starlink satellites??),6/25/20,
4/28/20 21:45,Iowa Park,TX,USA,Formation,1.5 minutes,19 starry objects in a line vanish. ((Starlink satellites??),6/25/20,
4/28/20 21:45,Lawton,OK,USA,Formation,5 minutes,Linear light formation traveling east. ((Starlink satellites??),6/25/20,
4/28/20 21:35,Leicester,NC,USA,Formation,5 minutes,A string of fast moving lights moving rapidly from north to south. ((Starlink satellites??),6/25/20,
4/28/20 21:31,Oklahoma City,OK,USA,Other,More than a minute,We were on our way inside when we seen something flying in the sky. The way it moved did not resemble an aircraft that we know of.,9/9/22,Yes
4/28/20 21:30,Richlands,NC,USA,Light,15 minutes,lights evenly spaced traveling west to east. for aprox 15 min.. ((Starlink satellites??),6/25/20,
4/28/20 21:30,Fordyce,AR,USA,Light,5-10min,Lights traveling. ((Starlink satellites??),6/25/20,
4/28/20 21:30,Louisville,KY,USA,Light,5 MINUTES,Numerous lights moving in a single file seen in the nighttime sky. ((Starlink satellites?)),6/25/20,
4/28/20 21:30,Folly Beach,SC,USA,Light,3 minutes,Approx. y 40 white lights in a straight line moving from right to left all disappearing at a certain point. ((Starlink satellites?)),6/25/20,
4/28/20 21:30,Greensboro,NC,USA,Formation,5 minutes,"23 unidentified flying objects in single file formation, flying at a high rate of speed. ((Starlink satellites?))",6/25/20,
4/28/20 21:30,Elkview,WV,USA,Light,30 seconds,5-6 star like objects in a straight line moving across the sky from west to south east. ((Starlink satellites>)),6/25/20,
4/28/20 21:20,Wichita,KS,USA,Formation,Minutes,Saw a bunch of round bright lights in formation across the whole sky..((Starlink satellites??),6/25/20,
4/28/20 21:19,Charleston,WV,USA,Light,About 2 minutes,Approximately 10 lights located high in the sky traveling simultaneously NW to SE. ((Starlink satellites?)),6/25/20,
4/28/20 21:15,North Augusta,SC,USA,Light,10 minutes,Long string of lights traveling for south west to the north east. Evenly spaced apart. ((Starlink satellites?)),6/25/20,
4/28/20 21:15,Boiling Spring Lakes,NC,USA,Other,90-120 seconds,"Numerous objects, similar in size and brightness to stars at night, moving rapidly in a northwest to southeast arc, then disappearing.",6/25/20,
4/28/20 21:09,Watsonville,CA,USA,,,MADAR Node 105,6/25/20,
4/28/20 21:00,Mays Landing,NJ,USA,Circle,20 seconds,30 silent bright lights moving fast in a row. ((Starlink satellites?)),6/25/20,
4/28/20 21:00,Easley,SC,USA,Light,18 minutes,50 light anomalies headed north east in PERFECT FORMATION AND SPACING apart. ((Starlink satellites??),6/25/20,
4/28/20 21:00,Baltimore City,MD,USA,Circle,10 seconds,Bright circular lights flying in unison. ((Starlink satellites?)),6/25/20,
4/28/20 21:00,Merrilville,IN,USA,Light,1:45,UFOs Might be Observing Elon Musks StarLink satellites!,6/25/20,
4/28/20 20:55,Scotts Valley,CA,USA,Chevron,5-10 seconds,"Large, dim, chevron shaped craft seen at night traveling north and accompanied by an oblong craft traveling very fast",6/25/20,
4/28/20 20:51,Newark,DE,USA,Light,1 minute,Lights moving evenly in single file at a fast pace. ((Starlink satellites?)),6/25/20,
4/28/20 20:50,Pueblo,CO,USA,Light,2-3 minutes,Traveling lights over Pueblo. ((Starlink satellites??),6/25/20,
4/28/20 20:45,Cottonwood,AZ,USA,Disk,5 seconds,"flew from East to West in straight line, flat circular object with dim white lights around edges. Seem to become brighter and then va",6/25/20,
4/28/20 20:45,Beaverton,OR,USA,Sphere,15 seconds,"Appeared out of nowhere, slighyly above the tree line, crossed over roadway, east to west. White ball of light, crossed quickly then sp",6/25/20,
4/28/20 20:45,Medford,OR,USA,Fireball,10 seconds,Flaming object traveling extremely quickly from east to west duration lasting between 3 and 8 seconds descended towards Jacksonville.,6/25/20,
4/28/20 20:40,Salem,OR,USA,Circle,2 minutes,"I was driving on Cordon Rd, from Ward Dr to State St when I saw it. It was going perpendicular of my driving. It was just below the clo",6/25/20,
4/28/20 20:30,Dixon,NM,USA,Light,5min,"A string of lights symmetrical in distance apart, moving quick across the sky and then fading away. ((Starlink satellites?))",6/25/20,
4/28/20 20:30,Albuquerque,NM,USA,Light,2 minutes,UFO - Red light hovers over Sandia Mountain then at low it changes to two different colors and dissappears!!,6/25/20,
4/28/20 20:27,Tulsa,OK,USA,Triangle,58 seconds,Photos of ufo hidden in cloud bank after thunderstorm.,6/25/20,
4/28/20 20:26,Spencer,OK,USA,Disk,30-45 seconds,"There was a single line of 13 saucer shaped disc headed east, there was no no noise. ((Starlink satellites??)",6/25/20,
4/28/20 20:10,Palmer Lake,CO,USA,Light,,There was a line of craft perfectly spaced traveling across the sky. ((Starlink satellites?)),6/25/20,
4/28/20 20:00,Hope Mills,NC,USA,Formation,20 Seconds,A perfectly straight line of bright lights were flying by overhead then ascended into outer space. ((Starlink satellites?)),6/25/20,
4/28/20 20:00,Trinidad,CA,USA,Disk,5 seconds,"Disk object seen flying at high rate of speed at low angle towards ocean. Surrounded by huge flames. Colored orange, yellow, blue, whit",6/25/20,
4/28/20 18:00,Gresham,OR,USA,Cigar,5 seconds,"Object was heading from east to west at an angle of descent. Was moving fast, unit it vanished. Entire object was lit up as a single li",6/25/20,
4/28/20 16:00,Baker City,OR,USA,Formation,45 minutes,I have never seen any thing like this and I use my binoculars several times a week.,6/25/20,
4/28/20 15:00,Eugene,OR,USA,Circle,Snap shot,4-28-20 3:10 pm I took three photos of a commercial plane flying East past our moon which was visible at the time. In the second photo,6/25/20,
4/28/20 12:00,Magnolia Park,FL,USA,Changing,11 minutes,Large white and green shape low in sky see in magnolia park fl,6/25/20,
4/28/20 11:15,Denver,CO,USA,Light,20 seconds,I was sitting outside viewing the norther sky when I noticed eight lights in the shape of the tip of an arrow ^ but facing downward. T,6/25/20,
4/28/20 11:00,Lake Quivira,KS,USA,Sphere,2 minutes,"During the morning we saw a UFO fly over us, black and transparent almost. It disappeared after a few minutes. Was weirdly shaped",6/25/20,
4/28/20 11:00,Granite Quarry,NC,USA,Sphere,8-10 seconds,Driving south on hwy 52 in Granite Quarry NC. 11:00am looked to the left and noticed a round shiney object 2 miles away and a few miles,6/25/20,
4/28/20 10:59,Portland,OR,USA,,,MADAR Node 66,6/25/20,
4/28/20 10:50,Ontario,OR,USA,Light,15 seconds,Satellite accelerated and changed directions around a seperate satellite very suddenly and quickly.,6/25/20,
4/28/20 09:30,Wilson,NC,USA,Light,10,20 lights flying single file evenly apart. ((Starlink satellites?)),6/25/20,
4/28/20 09:30,Statesboro,GA,USA,Fireball,5 mins,Several craft was shooting into the air and it lasted about 5 mins. It looked like a chain of lights. ((Starlink satellites?)),6/25/20,
4/28/20 07:20,Selinsgrove,PA,USA,Sphere,15 seconds,"Large Blue Sphere Over Susquehanna River, Selinsgrove PA, in the early morning hours of April 28, 2020",6/25/20,
4/28/20 02:10,Hermitage,PA,USA,Light,5 minutes,bright stationary star dims and brightens several times,6/25/20,
4/28/20 00:10,Säve,,,Triangle,00:10-00:27,prick vänder på himelen WTF.,6/25/20,
4/27/20 23:30,Kent,WA,USA,Circle,3-5 minutes,"Walked out side looking up at the night sky and thought to myself, wow theres a lot of stars tonight. Well then I realized that one of",6/25/20,
4/27/20 23:30,Maple Falls,WA,USA,Unknown,15 minutes,Last night we were outside and saw an object moving across the sky. ((Starlink satellites?))o,6/25/20,
4/27/20 23:00,Fayetteville,GA,USA,Egg,20 minutes,"Bright object over Atlanta, GA.",6/25/20,
4/27/20 23:00,Burnaby (Canada),BC,Canada,Light,one hour,Several star-like lights travelling across sky with one that sped up to avoid collision into another. ((Starlink satellites?)),6/25/20,
4/27/20 23:00,Carmichael,CA,USA,Light,30 seconds,It looked like the sheriffs helicopter with its spotlight on which is common in my area. Absolutely no no noise. It was flying direct,6/25/20,
4/27/20 22:45,Carryville,TN,USA,Formation,5 minutes,"I was driving home around 10:45 pm. I got off exit 134 in Carryville, Tn and over Covelake there were 3 orange lights. At first they we",6/25/20,
4/27/20 22:40,Raymond,WA,USA,Other,15-20 minutes,"24 lights from one spot in the sky, heading W S and E. ((Starlink satellites?))",6/25/20,
4/27/20 22:00,Lansdale,PA,USA,Cigar,25 minutes,UFO'S playing in the sky.,6/25/20,
4/27/20 22:00,Los Angeles,CA,USA,Circle,1 hour,It wasa Round Black Moon 45 degrees WNW with some yellow light coming through. The more West it moved it started fading away.,6/25/20,
4/27/20 22:00,Marshfield,MO,USA,Light,Apx. 10 minutes,Apx 22:00 went out and looked up and saw a line of lights moving in a straight line. ((Starlink satellites?)),6/25/20,
4/27/20 21:30,Kansas City,KS,USA,Formation,15 seconds,1 object with 6 lights or 6 smaller objects in a perfectly straight line moving West to east ((Starlink satellites?)),6/25/20,
4/27/20 21:20,Jefferson City,MO,USA,Light,5-7mins,A straight line of many multiple lights directly overhead. ((Starlink satellites?)),6/25/20,
4/27/20 21:15,Wentzville,MO,USA,Circle,1 minute,30-50 lights flew from west to east in a straight line disappearing overhead. ((Starlink satellites?)),6/25/20,
4/27/20 21:15,Chariton,IA,USA,Light,3 minutes,Line of 30-40 white lights moving single file through the sky from NW to SE,6/25/20,
4/27/20 21:15,Chesterfield,MO,USA,Formation,10 seconds,Star like formations moving quickly in sets of 3 across sky. ((Starlink satellites?)),6/25/20,
4/27/20 21:14,Warsaw,MO,USA,Other,5 min 2 times,Truman Dam Missouri string of lights. ((Starlink satellites?)),6/25/20,
4/27/20 21:10,Ruther Glen,VA,USA,Unknown,18 seconds,"Large ufo in Ruther Glen, VA. ((Starlink satellites?))",6/25/20,
4/27/20 21:10,Brentwood,TN,USA,Formation,2 minutes,little bright dots were lining up and heading to west and flying upwards and disappeared. ((Starlink satellites?)),6/25/20,
4/27/20 21:09,Watsonville,CA,USA,,,"MADAR Node 105, replaces 04/28/2020 same location",6/25/20,
4/27/20 21:08,Townsend,DE,USA,Formation,3 minutes,Lasted 3 minutes.right over my house 25 to 30 bright single and seperated by almost the same distance. ((Starlink satellites?)),6/25/20,
4/27/20 21:06,Sunbury,PA,USA,Circle,90 seconds,25 solid circular lights moving SE in a strait line. ((Starlink satellites?)),6/25/20,
4/27/20 21:05,Kitty Hawk,NC,USA,Formation,10 seconds,Observed straight line of 8-12 moving stars on a very clear night. ((Starlink satellites?)),6/25/20,
4/27/20 21:03,Ellicott City,MD,USA,Formation,2 minutes,"A lined formation of brightly lit objects moving West to East, 12-15 objects in two groups, ((Starlink satellites?))",6/25/20,
4/27/20 21:01,Buffalo,NY,USA,Formation,2 minutes,"A long queue of whitish round orbs, perhaps 15 total, in the south covering the whole heavens. ((Starlink satellites?))",6/25/20,
4/27/20 21:00,Williamsburg,VA,USA,Light,1 minute 30 seconds,40 plus lights detected in the sky traveling at a high rate of speed straight in a line. ((Starlink satellites?)),6/25/20,
4/27/20 21:00,Edwardsville,KS,USA,Light,5 sec,Walked outside and seen a straight line of about 15 lights not in a row but two or three separated by a space. ((Starlink satellites?)),6/25/20,
4/27/20 21:00,South Charleston,WV,USA,Light,5min,Strand of lights perfectly spaced moving in unison across the sky. I counted over 20 crafts. ((Starlink satellites?)),6/25/20,
4/27/20 21:00,North Potomac,MD,USA,Light,2 minutes,In a clear sky 12-14 star like objects flying in a straight line from North towards South . ((Starlink satellites?)),6/25/20,
4/27/20 21:00,Wyomissing,PA,USA,Unknown,>5 minutes,20 Lights in a row. ((Starlink satellites?)),6/25/20,
4/27/20 21:00,Chesapeake,VA,USA,Other,10 seconds,Five lights (looked like stars) moving south one behind the other and disappeared in succession. ((Starlink satellites?)),6/25/20,
