Date / Time,City,State,Country,Shape,Duration,Summary,Posted,Images
12/11/20 18:09,Burlington,VT,USA,Egg,2min,"Bright light shot up into the sky, very fast and then came to a complete stop and lingered.",12/23/20,
12/11/20 18:00,Louisville,KY,USA,Disk,3 minutes,"Saucer seen by two individuals over Louisville, KY.",12/23/20,
12/11/20 17:03,Lords Valley,PA,USA,,,MADAR Node 44,1/19/21,
12/11/20 16:20,Ridgecrest,CA,USA,Other,00:15,Multiple similar sized objects not flying as expected with bright lights underneath.,12/23/20,
12/11/20 13:34,Port Angeles,WA,USA,,,MADAR Node 49,1/19/21,
12/11/20 11:30,Summerville,VA,USA,Diamond,5 minutes,"((HOAX??)) A bright light appeared , three colored lights in back. It zigzagged , dropped to the ground behind hill.",3/2/21,
12/11/20 09:17,Aston,PA,USA,Triangle,15 min,Very large translucent triangle,12/23/20,
12/11/20 07:00,Rancho mirage,CA,USA,Sphere,3 hours,Noticed a sphere staying still in the sky. Clouds moving above it. Not moving for hours. Seemed like it soaking up the morning sun. As,12/23/20,
12/11/20 04:00,Oaktown,IN,USA,Diamond,Ongoing 24/7,"I have reported this once already,it is ongoing.The lights around my home & the Sawmill in Oaktown laminate,drone-like.I can see people",12/23/20,
12/11/20 00:03,Stonington,CT,USA,Cone,Continuing,"Long. Without my glasses, it looked like a cluster of stars.",12/23/20,
12/10/20 20:06,Chicago,IL,USA,Light,Two seconds,Ufo travelled at high speed and disappeared in a portal?,12/23/20,
12/10/20 20:05,Melbourne,FL,USA,Triangle,<1 minute,"Triangular objects over Melbourne, FL",12/23/20,
12/10/20 19:25,Hookstown,PA,USA,Fireball,3 to 4 seconds,"Fiery, bluish, rocket tail traveling the night sky at a super sonic speed, then disappearing; left a distinct smokey travel line.",12/23/20,
12/10/20 19:00,Alpharetta,GA,USA,Triangle,20 min,My daughter and I were driving on 400 near the Mansell Exit and we saw 3 orbs in the shape of a triangle very large that spanned the fr,1/19/21,
12/10/20 18:42,Naples,FL,Untied States of America,Triangle,3 minutes,Video taped something actting funny in the sky.,12/23/20,
12/10/20 18:42,Naples,FL,USA,Triangle,3 minutes,Triangle shape the strip it look to be bounce up sideways and down really fast.,12/23/20,
12/10/20 18:30,Owatonna,MN,USA,Unknown,1 minute,Object with multiple white lights flying east bound making a sharp southern turn then turning back west and finally turns south as it g,12/23/20,
12/10/20 18:00,Washington,DC,USA,Light,30 seconds,Bright light not blinking moves across sky making no sound.,12/23/20,
12/10/20 17:15,Carson City,NV,USA,Light,1 second,"Carson City, 12/10/20: Just after dusk looking at sky. In a split second 2 blue/white lights, streaked very high above me as fast as sn",12/23/20,
12/10/20 17:00,Lagrange,IN,USA,Light,30 minutes,Strange lights over Lagrange Indiana 12/10/2020,12/23/20,
12/10/20 15:00,Running Springs,CA,USA,Sphere,,Blue spherical shape with what appears to be evenly spaced lights all around it,9/9/22,Yes
12/10/20 06:55,Petoskey,MI,USA,Light,8 seconds,Bright Flash on Fast Little Light Traveling over Little Traverse Bay,12/23/20,
12/10/20 05:11,"Newport Beach, Pacific Ocean",CA,USA,Changing,I have video of 45 sec.,Initially I thought I might have been looking at a helicopter or drown because of the way the flickering light moved.,6/22/22,
12/10/20 04:13,Star Valley,AZ,USA,,,MADAR Node 53,1/19/21,
12/10/20 03:20,McConnell,WV,USA,Disk,3 seconds,Seen from old rt 10 on 3 mile curve. One disc like structure at high speed was witnessed to drop straight down behind tree line locate,12/23/20,
12/10/20 03:15,WinstonSalem,NC,USA,Other,45 mins plus,A bright not moving object with pulsating red light watched for 45min to 1 hour,12/23/20,
12/10/20 02:04,Garrettsville,OH,USA,,,MADAR Node 64,1/19/21,
12/10/20 01:00,Anaheim,CA,USA,Other,10 seconds,Black cube seen from 100 meters. Clear 3D object,12/23/20,
12/10/20,Naples,FL,USA,Triangle,3 minutes,Triangle shape the strip it look to be bounce up sideways and down really fast.,12/23/20,
12/9/20 00:00,Tucson,AZ,USA,Light,1 hour,A series of unusual lights seen in the Southern skies of Tucson,12/23/20,
12/9/20 21:47,York Harbor,ME,USA,Circle,44 minutes,Pulsating Circular Light in sky off Southern Maine Coast,12/23/20,
12/9/20 20:16,Port Orchard,WA,USA,Sphere,About 15 to 30 minutes,Saw amber orange rotating sphere,3/4/22,
12/9/20 20:15,Port Orchard,WA,USA,Sphere,30 minutes,"Orange floating rotating ball, appears to follow me as I Walk around",12/23/20,
12/9/20 19:24,Benton,LA,USA,Sphere,2 minutes,Two to three objects seemingly intelligently operated. Stopped then swelled in size with large flash and streak of light.,12/23/20,
12/9/20 19:00,Golden,CO,USA,Chevron,Unknown,I saw this only the next day as I was looking at the photos I took with my IPhone SE 2020. It must be a glitch in the camera. Could a s,12/23/20,
12/9/20 15:00,Greenfield,IN,USA,Light,,It was the size of a football field at least. This object was hovering over a barn on 200 North in Greenfield .,3/2/21,
12/9/20 10:19,Show Low,AZ,USA,,,MADAR Node 74,1/19/21,
12/9/20 07:15,Modesto,CA,USA,Sphere,All night,An amber colored orb drops in and hovers above Turlock and moves above the modesto area. There is also two bright white sphere's that c,12/23/20,
12/9/20 06:18,Oaklandon,IN,USA,,,MADAR Node 87,1/19/21,
12/9/20,Gloucester,VA,USA,Triangle,Five minutes,My sister called five minutes ago and told me to go outside and look up to see a triangluar vechicle moving through the sky with red an,12/23/20,
12/8/20 23:56,Fishers,IN,USA,Triangle,,"I heard a slight hum and looked up to see a huge triangular airplane with a light at the front, 1 in the middle, and 3 at the back.",3/2/21,
12/8/20 23:00,Bend,OR,USA,Other,6-7 hours,"We are missing 5-7 hours of time and my foot is now injured, and bruises all are healed from acute pancreatitis",12/23/20,
12/8/20 21:50,Great Meadows,NJ,USA,Triangle,5-10 minutes,2 Triangular Ufos with 3 bright green lights appeared in the sky and flew towards eachother.,12/23/20,
12/8/20 18:30,Denver,CO,USA,Light,ten minutes,"Flashing light in Denver, not plane or helicopter.",12/23/20,
12/8/20 18:30,Nogales,AZ,USA,Light,3-5m minutes,Flickering light stops in mid air and starts to shine really bright and ultimately disappears.,12/23/20,
12/8/20 18:10,OCEAN CITY,MD,USA,Light,15 minutes,2 sets of lights hovering over the ocean near the inlet. The lights kept appearing and disappearing in the same area. The lights were,12/23/20,
12/8/20 18:00,Fredericksburg,IA,USA,Rectangle,10 seconds,"I was Driving northbound on hwy 63, 3 miles south of hwy 18 when i saw a bright white lighted, Rectangular object moving very fast thro",12/23/20,
12/8/20 15:00,Greenfield,IN,USA,Light,,"It was the size of a football field at least, hovering over a barn on 200 North",3/2/21,
12/8/20 12:45,Eureka,KS,USA,Light,5 mins,Two white lights traveling at a high rate of speed.,12/23/20,
12/8/20 06:42,Kenmore,WA,USA,,,MADAR Node 47,1/19/21,
12/8/20 05:35,Princeton,KY,USA,Other,8-10 minutes,"I observed an orb of white light passing over north Princeton, going west to east. It was slow moving and without sound. Two family mem",12/23/20,
12/8/20 02:00,Pacifica,CA,USA,Circle,30 min,Circular red object hovering over Pacific Ocean,12/23/20,
12/7/20 23:23,Anamoose,ND,USA,Disk,2 hours,"Large, spinning , colorful UFO.",12/23/20,
12/7/20 22:32,Colorado Springs,CO,USA,Triangle,4-5 seconds,"Triangular object, white lights, silent but incredibly fast.",12/23/20,
12/7/20 21:00,Garden Valley,CA,USA,Chevron,5 minuetes,Large craft turns into two crafts then appears a third craft.,12/23/20,
12/7/20 20:30,ranchos de taos,NM,USA,Light,a few hours,"Multicolor flickering light shines bright, moves slow up into the sky until it's too far to be seen.",12/23/20,
12/7/20 20:15,Juno Beach,FL,USA,Sphere,5 min,2 orbs off Juno Beach,12/23/20,
12/7/20 19:30,Rockledge,FL,USA,Oval,5 minutes,"Saw 4 orange orbs in total, one passed right over my house slowly, but steadily, I couldnt really make out the shape because it was ver",12/23/20,
12/7/20 19:00,Slidell,LA,USA,Light,2 hours,"Here are longitude and latitude 30 18'15"" N 89 52'15"" w 30 17'39"" N 89 52'15""W 30 17'38""N 89 52'23""W",12/23/20,
12/7/20 17:56,North Java,,USA,Light,6 to 10 min.,Took dog out. Large bright white light directly overhead. Not moving then started moving to east and slightly south. Then began to de,12/23/20,
12/7/20 12:57,Phoenixville,PA,USA,Cigar,20 seconds,White haze horizontal cigar/ sphere shaped object. Flying from south to north. Very high in sky no sound. Consistent travel speed. I se,12/23/20,
12/7/20 05:20,Parrish,FL,USA,Sphere,3 minutes,It was a pink orb with a pink tail. When I sat in awe as it was coming down it slowly went up and almost looked as though it was twinkl,12/23/20,
12/7/20 04:45,Buffalo,NY,USA,Changing,Less than 1 minute,"Quick sighting of a strange object flying through the air, accompanied with a loud sound and strange energy.",12/23/20,
12/7/20 00:00,Jacksonville,FL,USA,Sphere,30 seconds,Saw sphere ufo moving up and down and side to side driving back from airport.,12/23/20,
12/6/20 22:00,Bordentown,NJ,USA,Rectangle,10 mins,Few thousand feet above roof..below Orion's belt. Flashing .. pulsing..zoomed in and rectangle shape...I have been trying Ce5 recently.,12/23/20,
12/6/20 20:10,Indianapolis,NY,USA,Light,5 minutes,Red/orange orb hovering and moving in a serpentine pattern in western sky,12/23/20,
12/6/20 19:00,Edmond,OK,USA,Unknown,45 seconds,Two extremely bright lights appear quickly high in the sky and disappear as fast.,12/23/20,
12/6/20 19:00,Northbrook,IL,USA,Unknown,,Witnessed near grocery store,12/23/20,
12/6/20 18:30,Pelican Rapids,MN,USA,Light,2 minutes,multiple star looking objects traveling in a straight line spaced evenly apart and then disappearing at the same point in the sky.,12/23/20,
12/6/20 17:55,Manheim,PA,USA,Triangle,10 ninutes,unusal obect in the sky,12/23/20,
12/6/20 16:45,Indianola,MS,USA,Cigar,10 min,It was about 445pm I was driving in the country and about 1 half mile away was 2 1500 foot tall radio towers and I noticed a small pink,1/19/21,
12/6/20 16:15,Signal Hill,CA,USA,Light,6 Minutes,"I was walking my dog in Signal Hill, Ca. which is a small city atop a hill which overlooks the City of Long Beach, Ca. From my vantage",12/23/20,
12/6/20 11:53,Fort Collins,CO,USA,Fireball,2 seconds,Large orange fireball,12/23/20,
12/6/20 06:24,Bozeman,MT,USA,Formation,10mins,20 objects in a straight line broke off figure eights separate directions,12/23/20,
12/6/20 00:25,Mt. Vernon,IN,USA,,,MADAR Node 119,12/23/20,
12/5/20 23:47,Grand Junction,CO,USA,,,MADAR Node 75,12/23/20,
12/5/20 22:30,Tucson,AZ,USA,Circle,About a minute,Glowing balls,12/23/20,
12/5/20 22:02,Kingman,AZ,USA,Cigar,10 min,"2 red orbs , followed by i bright orange,creeping across sky,evenly spaced",12/23/20,
12/5/20 22:00,Aguanga,CA,USA,Triangle,3 minutes,"These 3 triangular shaped , slow moving, stealth like objects use engines to fly.",12/23/20,
12/5/20 21:10,Breckenridge,TX,USA,Circle,5 minutes,"Orange Orbs over Breckenridge, TX",12/23/20,
12/5/20 20:30,Tallahassee,FL,USA,Light,1 minute,I was walking out to my truck after dark around 8:30 pm to leave after having dinner with my aunt and uncle. I stopped and looked up to,12/23/20,
12/5/20 19:30,Turnpike near Bristol township,PA,USA,Triangle,2-3 minutes,Big triangle takes off at the speed of light.,12/23/20,
12/5/20 19:10,Fairfield,ID,USA,Formation,30,"25 ufo's over Fairfield, ID",12/23/20,
12/5/20 19:03,Huron,SD,USA,Formation,3 min,Line of moving lights in sky,12/23/20,
12/5/20 19:00,Silt,CO,USA,Formation,3 minutes,"After sunset, looking to the West towards Grand Junction, CO we observed a row of lights, perfectly spaced apart, climbing from just ab",12/23/20,
12/5/20 19:00,Whitewater,WI,USA,Formation,1 minute,Straight linear formation of about 100 solid lights that went out one by one,12/23/20,
12/5/20 19:00,santa fe,NM,USA,Formation,?,I was walking home and through the sky I noticed a diagonal stream of twenty or more slow moving orange-ish lights blinking quickly in,12/23/20,
12/5/20 18:55,Leland,NC,USA,Formation,1 minute,"Two Bright Dots, moved simultaneously and faded",12/23/20,
12/5/20 18:45,Beaconsfield,QC,Canada,Formation,3- 5 minutes,8 lights in formation moving synchronously.,12/23/20,
12/5/20 18:33,Naubinway,MI,USA,,2 minutes,Forty Stars In A Straight Line As They Headed Towards Mars from West to East,12/23/20,
12/5/20 18:30,Columbia city,IN,USA,Sphere,10 sec,It was a trail of lights in a vertical line.,12/23/20,
12/5/20 18:00,Palmer Lake,CO,USA,Circle,3 minutes,These flying objects were flown with precision and their flight patterns were perfectly sequenced and it was highly organized.,12/23/20,
12/5/20 17:55,Shirley,NY,USA,Sphere,20 seconds,"I was driving down a long stretch of road when I saw off to the side a neon green sphere that dropped out of the sky, stopped, then sho",3/2/21,
12/5/20 17:30,Mount Shasta,CA,USA,Light,1-2 minutes,"20+ star-like, spread out objects moving in unison",12/23/20,
12/5/20 09:34,Hanover,MD,USA,,,MADAR Node 77,12/23/20,
12/5/20 08:30,North bend,WA,USA,Other,30 seconds,"I was waiting at the traffic light in town when I looked over to my right, above mailbox peak. What I saw was a very small, ""U&quo",12/23/20,
12/5/20 05:06,Orlando,FL,USA,Light,2 minutes,White circle of light and silver - vanished after 2 minutes,12/23/20,
12/4/20 23:20,Gig Harbor,WA,USA,Diamond,30,"I witnessed 2 diamond shaped hovering objects, multi colored lights, in the sky's above Purdy, WA. They are either quite small, or very",12/23/20,
12/4/20 23:00,Spokane,WA,USA,Disk,1 hour,Eastern Washington to the right of the moon and is a light flashing many colors like a twinkle of a star but bigger and twinkling faste,12/23/20,
12/4/20 22:20,Springfield,MO,USA,Triangle,6 seconds,The dim lights are all that we could see with no flashing. And no visible trail or sound.,12/23/20,
12/4/20 22:08,Lathrop,CA,USA,Sphere,5min,Two ufo's sighted over Lathrop CA at 10pm.,12/23/20,
12/4/20 19:20,Mountain home,ID,USA,Light,2 minutes,Straight Line of 10 stars seen in the sky to the southwest in western Idaho,12/23/20,
12/4/20 19:15,Deweyville,UT,USA,,5min,,12/23/20,
12/4/20 19:15,Deweyville,UT,USA,Circle,5min,Straight angled line of lights in the sky,12/23/20,
12/4/20 19:15,Middleton,ID,USA,Light,5 minutes,Line of bright white illuminated projectiles,12/23/20,
12/4/20 19:15,Hailey,ID,USA,Other,3-4 minutes,Straight line of lights in the sky that disappeared one at a time.,12/23/20,
12/4/20 19:05,Riverton,WY,USA,Light,approx. 1 minute,Round Light Object in sky,12/23/20,
12/4/20 19:00,Pacific City,OR,USA,Light,1 minute,A stacking column of lights,12/23/20,
12/4/20 19:00,Iowa City,IA,USA,Sphere,40s,UFO fleet in straight line pattern over Iowa City 04Dec2020,12/23/20,
12/4/20 18:50,Valentine,NE,USA,Circle,3 minutes,Very bright white lights moved in a straight line from west to east from Jupiter to Mars. Approximately 100 in the first event then 38,12/23/20,
12/4/20 18:50,Grants Pass,OR,USA,Formation,less than a minute,string of lights moving in a linear pattern and disappearing,12/23/20,
12/4/20 18:46,Blair,NE,USA,Light,2 minutes,A string of 12 lights moving southwest to northeast,12/23/20,
12/4/20 18:45,Mc Henry,IL,USA,Formation,3-5 minutes,12-15 white dot/dashes in straight line formation in Northern Illinois,12/23/20,
12/4/20 18:45,Alfred,ME,USA,Diamond,7 minutes,Ive seen drones fly in a night sky these things were so visible they were very noticeable,12/23/20,
12/4/20 18:30,South whitley,IN,USA,Unknown,30/45 seconds,"13 lights (what looked like stars but a bit bigger) moving at a steady pace, perfectly spaced out (but too close for airplanes) in a st",12/23/20,
12/4/20 18:30,Boulder,CO,USA,Circle,2 minutes,Uniform diagonal line of lights slowly moving across sky,12/23/20,
12/4/20 18:20,Longmont,CO,USA,Formation,2 min,Line of individual lights in Boulder County,12/23/20,
12/4/20 18:15,Evergreen,CO,USA,Circle,4 min.,Observed 15-20 white lights evenly spaced apart moving semi vertically in unison in the mountain sky.,12/23/20,
12/4/20 18:15,Lafayette,CO,USA,Light,5 Min,16 Lights following each other in a row,12/23/20,
12/4/20 18:13,Vacaville,CA,USA,Formation,5minutes,"75-100 Light formation over Vacaville, California",12/23/20,
12/4/20 18:00,Beecher,IL,USA,Light,,row of lights in perfect order and spacing,12/19/21,
12/4/20 18:00,Granite City,IL,USA,Formation,1 minute,String of lights in the night sky,12/23/20,
12/4/20 18:00,Nashville,TN,USA,Light,5 minutes,As I was leaving work tonight I saw an odd light in the sky above my office. At first I thought it wasa shoot light or maybe a plane. I,12/23/20,
12/4/20 17:46,Laramie,WY,USA,Formation,1 minute,Seven dim lights in the eastern sky were moving slowly in a northeasterly direction in a uniform fashion.,12/23/20,
12/4/20 17:45,Brookfield,IL,USA,Unknown,2 minutes,Walked outside to take my dog out. Looked up at the sky and saw several things that looked like stars moving across the sky to the sout,12/23/20,
12/4/20 17:45,Poplar Bluff,MO,USA,Formation,>3 min,10-15 stars in perfect formation traveling East. My son could not focus his phone to capture video. Amazing to see!,12/23/20,
12/4/20 17:45,Santa Fe,NM,USA,Light,30-45 seconds,"Bright lights (at least 10) in formation traveling at high altitude west to east at supersonic speed over Santa Fe, NM (seriously)",12/23/20,
12/4/20 17:30,Verona,WI,USA,Other,3 min,Straight line of 24 to 30 lights equally spaced moving across the sky.,12/23/20,
12/4/20 17:30,Englewood,CO,USA,Formation,30 seconds,"A saw a few dozen or so single white lights flying slowly in a perfect straight line. Looked about 1,000 ft. in elevation and a few hun",12/23/20,
12/4/20 17:00,Pueblo,CO,USA,Light,30 seconds,"5:30 or 5:40. Saw about 30 lights traveling from west to east. Evenly spaced across the entire visible night sky. Very high up, possibl",12/23/20,
12/4/20 16:00,"Municipal of Puerto Morelos,",,Mexico,Sphere,20 seconds,saw 2 translucent/white objects moving quickly in sky,12/23/20,
12/4/20 06:45,Urbandale,IA,USA,Formation,2 minutes,"At approximately 6:45pm, I walked outside with my family. We saw at least 20 lights in a line move in unison. The lights disappeared as",12/23/20,
12/4/20,Ft.atkinson,IA,USA,Circle,10 minutes,50 round lights in perfect row starting nw sky to nc sky moving slow. At aprox. 45 degees in sky lights faded out one at a time. Ligh,12/23/20,
12/3/20 22:00,Salina,KS,USA,Light,,My boyfriend was outside smoking a cigarette when he called me to the front porch there was at least 10 lights in a row going the same,12/23/20,
12/3/20 21:02,Jonesboro,AR,USA,,,MADAR Node 143,12/23/20,
12/3/20 20:00,Boise,ID,USA,Light,5 min,What looked like plane headlights approaching that suddenly streaked across the sky.,12/23/20,
12/3/20 19:45,Gilbert,AZ,USA,Formation,5 min,"Walking on golf course in Seville neighborhood, formation of lights going in circular rotation, too lights disappearing although no clo",12/23/20,
12/3/20 19:45,Columbus,OH,USA,Light,~1 minute,"Line of lights in western sky above Columbus, OH",12/23/20,
12/3/20 19:30,Cottage grove,OR,USA,Rectangle,15 -20 seconds,"We was in our home the whole property started to shake aggressively!!, we ran out front cause it sounded like an aircraft had crashed",12/23/20,
12/3/20 19:30,Hilliard,OH,USA,Circle,10 minutes,There was a big circle of lights in the sky. There was one in the middle of 8-10 lights that was a little brighter than the rest. When,12/23/20,
12/3/20 19:30,Fort Bragg,NC,USA,Rectangle,10 minutes,3 lights horizontally in a row moving horizontally in slow motion towards base. Too slow for a plae or helicopter to stay in the air. T,12/23/20,
12/3/20 19:15,Kirksville,MO,USA,Unknown,1 min,.⏬ .⏬ .⏬ .⏬ .⏬ .⏬,12/23/20,
12/3/20 19:15,Amherst,MA,USA,Chevron,30 seconds,On Friday December 3rd I spotted a black triangle aircraft flying North to South over Amherst Massachusetts.,12/23/20,
12/3/20 19:01,Clifton,CO,USA,Light,2 minutes,Strange lights in a straight line,12/23/20,
12/3/20 19:00,Mountain Home,ID,USA,Formation,2-3 minutes,"A strange formation of lights in the sky, like stars but in a distinct straight line.",12/23/20,
12/3/20 19:00,Laramie,WY,USA,Unknown,3 minutes,"Line of 10-12 lights moving in unusual linear, then angled pattern",12/23/20,
12/3/20 19:00,niwot,CO,USA,Light,1 min+,"strange 10+ perfectly diagonal lights over boulder, colorado foothills",12/23/20,
12/3/20 19:00,springfield,IL,USA,Light,15 seconds,saw a vertical line of 6 lights that were equidistant apart rising in the distant sky. They appeared to disappear into the clouds slowl,12/23/20,
12/3/20 18:42,Phoenix,AZ,USA,Formation,15 seconds,"4 perfectly spaced white lights, traveling slowly, until the lights disappear 1 by 1.",12/23/20,
12/3/20 18:30,Springfield,IL,USA,Other,4 minutes,"Saw between 20-30 diagonally aligned lights that looked like stars. They were southwest of Springfield, Il. They did not move but aft",12/23/20,
12/3/20 18:15,Hollister,CA,USA,Circle,3 min,Many craft moving quickly in a straight line.,12/23/20,
12/3/20 18:00,Arroyo Grande,CA,USA,Formation,3 min,"20+ ""string"" of lights that were ""chasing"" ea. other & were equally distanced from 1 another as they chased each ot",12/23/20,
12/3/20 18:00,Valley Glen,CA,USA,Other,18:15,"Several symmetrical, dim orange lights, moving slowly across the sky then fading away and disappearing.",12/23/20,
12/3/20 06:00,Forest Hills,NY,USA,Disk,15 minutes,I observed a disk/saucer shaped object high above my 31st floor terrace in a partly cloudy predawn sky. The disk was bright red and mo,12/23/20,
12/3/20 05:55,Northbrook,IL,USA,,,MADAR Node 98,12/23/20,
12/3/20 04:00,Great falls,MT,USA,Light,4 seconds maybe less,Appeared to be artificial light that bursted randomly out of montana sky's then tapered off as the object seemed to be falling towards,12/23/20,
12/3/20 03:43,Edmonds,WA,USA,,,MADAR Node 61,12/23/20,
12/2/20 00:00,Hopkins,MN,USA,Light,1 minute,I was smoking outside my apartment that night. Since Ilive in thecity there are no stars in the sky. The only thing I can see in the ea,12/23/20,
12/2/20 23:00,Richmond,VA,USA,Light,5 minutes,Strange flashing lights hovering and the sound of whales singing from all around me in the sky,12/23/20,
12/2/20 23:00,Lords Valley,PA,USA,Cone,4 mins,Top-shaped object. Witness was unnerved by fact it was shining a search beam looking for something.,12/23/20,
12/2/20 22:00,Fairfield,CT,USA,Light,.60,"two objects that appeared through my camera as white, seem that they had the ability to become one and seperate at high speed.",3/31/21,
12/2/20 19:00,mexico,,mexico,Sphere,still live,"is still live on webcams de mexico or quantum noticias, it has been ther for more than 24hrs, it was impresive at dawn!!!! https://www.",12/23/20,
12/2/20 19:00,Loveland,CO,USA,Light,3 minutes,Stream of perfectly spaced light objects,12/23/20,
12/2/20 18:50,Joshua tree,CA,USA,Formation,1minute,A formation 20 to 30 lights suddenly appearing from the east one after the other moving northwest and disappearing.,12/23/20,
12/2/20 18:45,Tucson,AZ,USA,Light,two minutes,"Steady line of small lights travelling west to east in Tucson approximately 18:45 December 2, 2020",12/23/20,
12/2/20 18:30,Lehighton,PA,USA,Fireball,2 seconds,It was obviously on fire yet no meteors were reported plus if it were a meteor it would be moving side ways this thing came straighdown,12/23/20,
12/2/20 18:05,San Diego,CA,USA,Circle,Aprox 2 to 3 minutes,"Witnesses to the sighting were myself age 51 (Fire Alarm System Inspector), Dad age 81 (Sales executive in aircraft bearings industry a",12/23/20,
12/2/20 18:05,Chatsworth,CA,USA,Formation,5 minutes,Straight line of UFOs moving West to East over Chatsworth CA,12/23/20,
12/2/20 18:00,Watsonville,CA,USA,Formation,3:00 minutes,Disturbing but exciting experience. Formation of lights.,12/23/20,
12/2/20 18:00,San Jose,CA,USA,Light,1 minute,A single line of 25 flying light objects flying moving faster than a satellite,12/23/20,
12/2/20 17:44,Chula Vista,CA,USA,Light,1 minute,"On Wednesday December 02, 2020 at approximately 1744 hours while working out at Norman Park in Chula Vista, California located at Del M",12/23/20,
12/2/20 17:30,"laughlin ,",NV,USA,Light,5:00 minutes,"A single file line of lights in the night sky with the exception of one light set slightly off to the side. Estimated altitude of 10,00",12/23/20,
12/2/20 15:20,Simpsonville,SC,USA,Light,00:03:47,An identical sighting almost one year after the first one over the SC sky,12/23/20,
12/2/20 08:58,Clovis,NY,USA,Unknown,Roughly around an hour,Several objects some look like crafts but most move so fast normal speed recording does not show without digging,4/22/22,Yes
12/2/20 08:00,Anderson,IN,USA,Oval,10 seconds,"Driving 50 MPH East bound when I observed a metallic, stationary/oval shape in South Eastern sky 10 to 15,000 feet in elevation that wa",12/23/20,
12/2/20 06:00,Riverside,CA,USA,Circle,1 to 2 min,"About 15 white round lights in a formation, from left to right way lower than a satellite than disappeared. I live by March AFB",12/23/20,
12/2/20 02:30,Bayonne,NJ,USA,Oval,3+ hours,"I got up to the bathroom after 2 in the morning, from the window I could see some very bright lights were 4 lights in an almost square",12/23/20,
12/2/20 01:00,Stamford,CT,USA,Circle,5 minutes got scared went,12/02/2020 UFO 1.	SIGHTING I took my dog outside at 1:00 am. Something caught my eye in the sky and I looked up I could see about 15,12/23/20,
12/2/20,palm desert,CA,USA,Changing,5 minutes,"spinning, flashing light. diamond shaped up by clouds no noise stayed in one spot move slowly straight up day light 4pm similar to uf",12/23/20,
12/1/20 23:00,Sekiu,WA,USA,Circle,3 minutes,Bright object flew into the water followed by burst of light outward from place of impact.,12/23/20,
