Date / Time,City,State,Country,Shape,Duration,Summary,Posted,Images
12/1/20 22:30,Tyler,TX,USA,Light,1.5 Mins,"Three lights, moving in same relative direction: From NE to SW on fast but steady course",12/23/20,
12/1/20 21:15,Cumming,GA,USA,Fireball,1-2 minutes,Two slow moving fireballs following each other parallel to the earths surface,12/23/20,
12/1/20 20:00,san bernardino,WA,usa,Cone,30 minites,Strange lights over San Bernardino California,12/23/20,
12/1/20 20:00,Baton Rouge,LA,USA,Circle,all night,"lights, orbs, spaceships, and drones all following me for months",12/23/20,
12/1/20 19:30,Trexlertown,PA,USA,Light,2 seconds,Saw a massive bright green beam of light shoot out of the ground into the sky,12/23/20,
12/1/20 17:58,Granite City,IL,USA,Light,8 seconds,"2 White lights moving in unison in Granite City, IL",12/23/20,
12/1/20 17:50,Birmingham,AL,USA,Light,10 seconds,Bright light moving sporadically up and down and across the sky,12/23/20,
12/1/20 17:00,Wilmington,DE,USA,Cylinder,30 sec,Driving on Old Coach Road towards Polly Drummond Road at 5pm when noticed a skinny object with a red and white light at either end fly,1/19/21,
12/1/20 14:45,Weidman,MI,USA,Light,4-5 minutes,Extremely bright mirror like light that left vapor trail then disappeared in clear sky,12/23/20,
12/1/20 12:00,Millstone,NJ,USA,Circle,5 mins,It flew across highway dropped to the ground and sky rocketed,12/23/20,
12/1/20 09:00,Barnegat Township,NJ,USA,Unknown,30 min,Witnessed object being chased by fighter jets 30 passes so far,12/23/20,
12/1/20 06:00,Hyde Park,VT,USA,Diamond,30 sec,I saw a very bright light in the sky and then it disappeared.,12/23/20,
12/1/20 05:09,Jonesboro,AR,USA,,,MADAR Node 143,12/23/20,
