Date / Time,City,State,Country,Shape,Duration,Summary,Posted,Images
12/31/20 23:30,Port St John,,USA,,5 minutes,Orange Fireball the size of a football glided noiselessly over our house towards the fields in the refuge area. It was slow and steady,1/19/21,
12/31/20 23:30,Damascus,MD,USA,Fireball,12:00,Red sphere transitions into an eye...,1/19/21,
12/31/20 23:10,Palm Springs,CA,USA,Formation,3 minutes,"4 orange lights , one behind the other. Then a 5th one going faster to catch up. One by one they all went dark.",1/19/21,
12/31/20 22:38,Caldwell,ID,USA,Circle,2 min,"Out back on my patio, my wife and i saw a very large orange orb floating through the sky. Got video and picture if it. It came up slowl",1/19/21,
12/31/20 22:30,Ashland,NH,USA,Sphere,10-15minutes,"Large, brightly glowing orange spheres, which moved in a pattern of hovering and rapid movement.",1/19/21,
12/31/20 22:30,Nazareth,PA,USA,Fireball,2 minutes,Pulsating orange orb in eastern sky,1/19/21,
12/31/20 21:20,Oak island,NC,USA,Light,3 min,Yellow light moving north over Oak Island NC,1/19/21,
12/31/20 21:15,Roseville,CA,USA,Light,5 minutes,Two Light Orbs Appear for 5 Minutes in Night Sky,1/19/21,
12/31/20 21:02,Seattle,WA,USA,Formation,3-5 minutes,V formation made up of three dots rose out of the tree-line and then quickly disappeared.,1/19/21,
12/31/20 21:00,Edmonton,AB,Canada,Formation,3-5,Three Orange Lights Triangle,1/19/21,
12/31/20 21:00,Tempe,AZ,USA,Oval,40 seconds,"orange light traveling east then slows, turns north and stops. 20 seconds later fades out",1/19/21,
12/31/20 20:50,Oakridge,OR,USA,Triangle,7 seconds,"Triangular-Egg shaped craft caught in still photo north of Klamath Falls, Or.",1/19/21,
12/31/20 20:00,dunstable,,United Kingdom,Changing,5mins felt longer guessin,lights seen in clouds asked them to unclock messing around but some crafts showed them self,9/9/22,
12/31/20 19:31,Florence,AZ,USA,Sphere,4 minutes,Glowing Sphere over roof tops at Merrill Ranch in Florence AZ,1/19/21,
12/31/20 19:00,Morro Bay,CA,USA,Other,2-3 mins,Morro bay orbs New Years Eve2020,1/19/21,
12/31/20 18:00,sellersville,PA,USA,Circle,6 minutes around,6-7 Orange/Red UFOs,1/19/21,
12/31/20 17:40,Surprise,AZ,USA,Cigar,1.22,White glowing tictac or cigar shaped craft spinning completely silent heading north in the surprise AZ sky,3/2/21,
12/31/20 17:00,Eagle Lake,ME,USA,Disk,40 Minutes,UFO In My Backyard On New Years Eve,1/19/21,
12/31/20 05:06,Helotes,TX,USA,,,MADAR Node 158,1/19/21,
12/31/20 04:33,Jonesboro,AR,USA,,,MADAR Node 143,1/19/21,
12/31/20 01:37,Orlando,FL,USA,Triangle,approximately one second,Green triangle rapidly and silently moving East,1/19/21,
12/30/20 22:37,Manchester,CT,USA,,,MADAR Node 151,1/19/21,
12/30/20 21:00,Castle Rock,CO,USA,Sphere,<10s,It was a silentl spherical orb of a dark color or transparently distorting the clouds behind it.,1/19/21,
12/30/20 20:45,Wellington,FL,USA,Light,30 minutes,numerous objects heading southeast in staggered formation of 2-3 each with as many as 6 within 60 degree arc traversing sky from northw,1/19/21,
12/30/20 19:52,Coral Gables,FL,USA,Sphere,5 minutes,Orange-reddish orb floating slowly heading West at about 400 feet making no sound,1/19/21,
12/29/20 23:00,Belleville,ON,Canada,Flash,Seconds to 1 Minute,4 Greenish Blue Blob-Like Objects Flashing Low In Southern Sky,1/19/21,
12/29/20 22:00,Spotsylvania,VA,USA,Flash,Every night for weeks,My name is ((deleted)) and for the last couple of weeks me and my wife and grandkids have been watching this flashing light in the ski.,1/19/21,
12/29/20 20:00,Port St. Lucie,FL,USA,Teardrop,3 min,At 20:00 pm on the 29th of Dec 2020. I heard a swishing sound coming from our side of my home . I went to investigate looking up,1/19/21,
12/29/20 20:00,McKees Rocks,PA,USA,Light,5 minutes,Red lights hovering above Pittsburgh suburbs.,1/19/21,
12/29/20 19:30,Dublin (Ireland),County Dublin,Ireland,Light,Not sure,"Several lights seen in the sky over dublin city, lights dud not seem to be moving but dissapeared",3/4/22,
12/29/20 16:27,Eatontown,NJ,USA,Sphere,30mins,"Small reflective orb flying over monmouth county, nj followed by several military jets.",1/19/21,
12/29/20 16:16,Oaklandon,IN,USA,,,MADAR Node 87,1/19/21,
12/29/20 16:05,Raleigh,NC,USA,Circle,5 seconds,I saw a large solid black circle next to a cloud parking my car. It was perfectly still and did not move. I continued to stare at it an,1/19/21,
12/29/20 12:11,Port Angeles,WA,USA,,,MADAR Node 49,1/19/21,
12/29/20 06:44,Farmington Hills,MI,USA,,,MADAR Node 144,1/19/21,
12/28/20 21:30,Garner,NC,USA,Light,20 minutes,Bight white orb moving fast but fluid in multiple direction in sky. Possibly saw another orb couldnt confirm.,1/19/21,
12/28/20 20:50,Henderson,NV,USA,Circle,4 minutes,3 low flying circular objects with flashing orange lights,1/19/21,
12/28/20 18:35,Oronoco,MN,USA,Fireball,2 hours,about 6:35pm I went out side with my little brother to use our Orion telescope to look at the moon and stars. We both saw and orange lo,1/19/21,
12/28/20 17:35,Beaverton,OR,USA,Triangle,20 Minutes,Triangle UFO westbound,1/19/21,
12/28/20 17:35,Hillsboro,OR,USA,Triangle,20 minutes,Truangle tracked for 20 minutes headed west,1/19/21,
12/28/20 17:35,Beaverton,OR,USA,Triangle,10 minutes,Triangle UFO moving west,1/19/21,
12/28/20 14:45,Tallahassee,FL,USA,Changing,5 min+,"3 bright white objects changed direction and shape formation, then merged into 1 oblong object",1/19/21,
12/28/20 14:00,Placentia,CA,USA,Unknown,2 seconds,Cluster bubble object in air.,1/19/21,
12/28/20 13:22,Marietta,GA,USA,Circle,,Bright circle light moving slowly then 30 seconds later it faded and disappeared.,1/19/21,
12/28/20 06:15,Marion,IA,USA,Light,4 min,Night red light with small white lights.,1/19/21,
12/27/20 22:20,La Plata,MD,USA,Sphere,5 seconds,A yellow sphere circle twice and the zoom out to disappear. It traveled from Northeast to the Southwest,1/19/21,
12/27/20 21:57,Vernal/Naples,UT,USA,Fireball,5 minutes,"we are looking west as we walk out toward the trucks from house as seen at the bottom of screen . It was coming at us going East, then",1/19/21,
12/27/20 19:15,Hensley,AR,USA,Formation,1 hour,"I noticed what I thought was a satellite in the sky above my house,my daughter pointed out that there were several others.they were mov",1/19/21,
12/27/20 19:00,Boone,NC,USA,Unknown,4 seconds,"Driving home probably 6-8 pm et. Saw a very bright white light (looked exactly like a bright star) fall straight downward. No tail, ext",1/19/21,
12/27/20 16:30,Outside of truth or consequences,NM,USA,Changing,8 minutes,Cigar shape object that changed shape to a fish like object and others to appear to have landing legs.,1/19/21,
12/27/20 15:43,Houston,TX,USA,,,MADAR Node 118,1/19/21,
12/27/20 04:00,Waco,GA,USA,Circle,1 hour,Blue red white pulsating orb moving at a high rate of speed across the sky and in figure 8 while blinking in and out,1/19/21,
12/27/20 03:43,Lords Valley,PA,USA,,,MADAR Node 44,1/19/21,
12/26/20 23:50,Waldron,AR,USA,Light,5 seconds,"It was a green light with a trail, traveling at an insane speed, I have seen shooting stars and this was not one of them.",1/19/21,
12/26/20 22:55,Bradenton,FL,USA,Fireball,7 min,5 red orbs,1/19/21,
12/26/20 21:40,Delmar,MD,USA,,20min,Unexplainable bright pulsating yellow-orange object hovering and then flying away at a high rate of speed.,1/19/21,
12/26/20 20:00,Topeka,KS,USA,Cigar,Approx 10 minutes,Blue colored circular object in the night sky.,1/19/21,
12/26/20 19:17,,BC,Canada,Unknown,,Yellow. illuminated odd shaped object.,1/19/21,
12/26/20 18:20,Decatur,AL,USA,Light,45 seconds,single white light rapidly blinking. Decatur Alabama 6:20 pm. clear night stars were out. total view time approximately 45 seconds. dir,1/19/21,
12/26/20 16:33,Jamesport,NY,USA,Light,5 seconds,Saw ufo 12-26-2020,1/19/21,
12/26/20 15:45,Raleigh (13 miles SW of)(in-flight),NC,USA,Unknown,<1 second,A flying object at 29000 feet. ((NUFORC Note: REPORT FROM COMMERCIAL AIRLINE PILOT. PD)),1/19/21,
12/26/20 15:00,Whittier,CA,USA,Sphere,10 minutes,"Orb of light, splits into two orbs.",1/19/21,
12/26/20 13:00,"Hondo, Seco",NM,USA,Circle,2 hours,There is a bright flashing circular object over Taos Mountain/Taos Ski valley area. it seems to get bigger and brighter then back to sm,1/19/21,
12/26/20 09:30,DIberville,MS,USA,Cylinder,5 minutes,Saw metallic cylinder shaped object that didnt move at about 8000 feet in the sky,1/19/21,
12/26/20 07:00,Oaksboro,NC,USA,Changing,Night and day,"I have seen for weeks now orbs in the sky and on the ground they seem to be communicating with these space craft in the sky, spycraft t",1/19/21,
12/26/20 06:15,Chesapeake,VA,USA,Unknown,5 minutes,Very bright blinking white object in early morning western sky on 12/26/2020,1/19/21,
12/26/20 03:45,Norwalk,CT,USA,Triangle,5 minutes,It was a clear enough night to see it was triangular in shape with no sound moving very slowly,1/19/21,
12/26/20 02:10,Temple City,CA,USA,Circle,5 minutes,2 reddish yellow pulsating slow moving lights hovering over Los Angeles,1/19/21,
12/25/20 23:30,Hyden,KY,USA,Unknown,Unknown,"Bright red orb reported by local 911 center, law enforcement dispatched to investigate sightings",1/19/21,
12/25/20 20:29,Long Island,NY,USA,Disk,1 minute,Actual ufo in the sky with light beam - I have never seen anything like this before in my life.,1/19/21,
12/25/20 20:00,Salt Lake City,UT,USA,Fireball,10 minutes,Multiple glowing orange lights flying around in the dark evening sky for several minutes,1/19/21,
12/25/20 20:00,Santa Fe,NM,USA,Other,Seconds,"Large flash through sky, exact point of origin unknown, approximate to south side of town. Flash was quick and indescribable, light pro",1/19/21,
12/25/20 19:00,Star,ID,USA,Unknown,5 minutes,red lights in a round configuration hovering was not a drone nor an aircraft,1/19/21,
12/25/20 12:30,Wolverhampton (UK/England),,United Kingdom,Sphere,10 seconds,I was driving down newhampton road with my daughter when we seen a basketball size metallic ball floating in the sky about 50ft high. W,5/20/21,
12/25/20 09:00,San Pedro,CA,USA,Changing,45 minutes,"Outside of my window on Christmas day (from second story apartment), I had a strange feeling to look outside and so I did. I noticed im",1/19/21,
12/24/20 23:30,West Chester,PA,USA,Sphere,5 minutes,1 sphere like round firework. Still. Turned into 3 spheres. No sound until deep hum. No movement @1st. Then 3 from NW to SE.,1/19/21,
12/24/20 23:25,Hoorn (Netherlands),,Nederland,Unknown,About five minutes,"Blinking lights, erratic movement, very far away.",1/19/21,
12/24/20 23:00,Hollywood,FL,USA,Other,2 minutes,I was standing at the gas station waiting on car to be lifted on a tow truck. A object shooting up caught my attention. I thought it wa,1/19/21,
12/24/20 22:14,Chehalis,WA,USA,Light,8 mins,A row of horizontal orange lights moving in formation then they began diverging in different directions twinkling on and off until they,1/19/21,
12/24/20 20:10,Marshall,MI,USA,Circle,1 minute,"Fast moving, large orange orbs in the sky.",1/19/21,
12/24/20 19:20,Renton,WA,USA,Light,30min,My wife and I saw 7 red light in the shy over Renton Wa,1/19/21,
12/24/20 16:30,Canon City,CO,USA,Oval,5,"Something in the sky, government planes appear to be heading toward it.",1/19/21,
12/24/20 13:50,Mt. Vernon,IN,USA,,,MADAR Node 119,1/19/21,
12/24/20 00:35,Secaucus,NJ,USA,Light,2min,Watched Small bright light travel southwest of manhattan. It was small solid light watched it for a minute or 2. It was lower than the,1/19/21,
12/23/20 21:00,New Bern,NC,USA,Light,15 seconds,3 bright lights horizontaly in a row,1/19/21,
12/23/20 19:30,Keller,WA,USA,Sphere,A few seconds,"Sphere-shaped craft seen in sky north of Keller, WA. Two of us were traveling down the east side of Cache Creek Rd at 7:30 pm on 12/",1/19/21,
12/23/20 18:00,Wenatchee,WA,USA,Light,5 minutes,Two lights in night sky moved in controlled patterns both orange with white light dropped from one,1/19/21,
12/23/20 17:07,Leavenworth,WA,USA,Oval,5 seconds,Green saucer with orb figure 8 and bursts off,1/19/21,
12/23/20 08:00,Brentwood,CA,USA,Triangle,00:50,((NUFORC Note: Witness provides no detailed information; elects to remain totally anonymous. PD)),1/19/21,
12/23/20 07:30,Canadian Lakes,MI,USA,Light,5 seconds,"light in sky ,no sound",12/23/20,
12/23/20 03:18,Grants,CA,USA,Light,2 Seconds,Bright Orb seen below plane level at Mach 1+ Speeds,12/23/20,
12/23/20 03:00,East Quogue,NY,USA,Other,30 mins,"flickering colored lights in the night sky, indistinguishable shape, sort of swaying / hovering / rotating around.",12/23/20,
12/22/20 22:45,Indian River Shores,FL,USA,Changing,4 minutes,Orange orb over Indian River Shores Florida,12/23/20,
12/22/20 22:05,lake elsinore,CA,USA,Light,30 seconds,saw a glowing object.shape not discerned. travelling somewhat slowly.direction roughly Northeast to Southwest. large and somewhat Long,12/23/20,
12/22/20 21:00,Searsport,ME,USA,Changing,Over an hour,Bright changing objects hovering over Searsports bay making dipping motions and then we noticed a three lighted object very very high,1/19/21,
12/22/20 20:00,Jersey City,NJ,USA,Unknown,45 seconds,"Object with Red Blinking lights, went flying super fast over the hudson from south to north. It was not unreal fast, but too fast for s",12/23/20,
12/22/20 18:46,Simla,CO,USA,Light,5 mins,Orange-tinged light faded for 10s and reappeared in slightly different position. No debris trail or noise.,1/19/21,
12/22/20 12:28,Tampa,FL,USA,Disk,1-2 seconds,Disc shaped with red orb spotted,3/2/21,
12/22/20 08:00,Pembroke,MA,USA,Circle,60,"Green, Orange and White Lights Low to Ground in Pembroke, MA USA",12/23/20,
12/22/20 06:47,South Salem,OR,USA,Triangle,20 seconds,Was walking down the block was coming back home I was actually playing a phone game I was looking down then looked up look down again o,12/23/20,
12/21/20 23:15,Salome,AZ,USA,Light,10 seconds,White light duplicating itself in a pattern,1/19/21,
12/21/20 19:10,Hayesville,NC,USA,Changing,While taken pictures,I was taking pictures of the Christmas star. I was not using flash to take the pictures and the pictures was taken of my phone(A50),12/23/20,
12/21/20 19:00,Quartzite,AZ,USA,Triangle,3 minutes,Two sets of three Red Lights in Western sky that appeared and disappeared 10-15° above the Horizon.,12/23/20,
12/21/20 18:00,Virginia City,NV,USA,Flash,20 seconds,"We were observing the Great Conjunction with a telescope. After Jupiter/Saturn had set below the horizon, we turned to Mars, just sout",12/23/20,
12/21/20 17:30,Rosemead,CA,USA,Light,5 seconds,Point of light streaks across the sky over Los Angeles,12/23/20,
12/21/20 16:40,Long Beach,CA,USA,Light,4 seconds,Streak of horizontal light over Long Beach,12/23/20,
12/21/20 15:30,Thousand Oaks,CA,USA,Light,1-3 seconds,White flash in the sky,12/23/20,
12/21/20 03:00,Gulfport,MS,USA,Other,1-2 mins,I went outside. I always look around. And above the tree line behind my house.there was a rather large ball of light. Starting from the,12/23/20,
12/21/20 01:40,Cathedral City,CA,USA,Triangle,12 minutes,"Triangular object to the south of Palm Springs/Cathedral City, CA over the mountain. Would zig-zag side to side and at times appeared b",12/23/20,
12/21/20 01:00,Los Banos,,,Light,,My name is ((name deleted)),12/23/20,
12/20/20 00:00,Starkville,MS,USA,Fireball,15-20 min,Total of 3 orange spheres with what appeared to be rings of fire within,12/23/20,
12/20/20 22:30,Belleville,ON,Canada,Unknown,3 minutes,Looked out my kitchen window and noticed a bright light below the clouds. I was about to turn away when it sped off to the east quickly,12/23/20,
12/20/20 21:00,Escondido.,CA,USA,Triangle,2hrs,Crafts were flying individually low flying landing on apartment buildings some were red and some were white lights and made sound when,12/23/20,
12/20/20 20:22,Hastings,FL,USA,Circle,10 minutes,Thought we were looking for a planet that was supposed to be close,10/8/22,
12/20/20 17:25,Maidenhead,,United Kingdom,Sphere,2-3 minutes,Line formation of stars moving west-east in the sky,12/23/20,
12/20/20 16:00,Terrell,TX,USA,Triangle,1 min,"We saw a chrome looking object approx 1500 to 2000 ft up., no clouds this day,none.it disappeared before our eyes. Was large ,not a kit",3/2/21,
12/20/20 15:30,Edmonton (Canada),AB,Canada,Oval,LESS THAN 1 SECOND,"VERY, VERY FAST OBJECT",1/19/21,
12/20/20 14:47,Louisville,KY,USA,,11:47,Unnatural Extraterrestrial activity and violation to the human body and mind,3/4/22,Yes
12/20/20 13:47,Louisville,KY,USA,Unknown,11:47,Unnatural Extraterrestrial activity and violation to the human body and mind,3/4/22,Yes
12/20/20 04:47,Grand Junction,CO,USA,,,MADAR Node 75,1/19/21,
12/20/20 04:06,Albuquerque,NM,USA,Triangle,40 mins,V shape of 7 ish lights over Abq,12/23/20,
12/20/20 03:24,Star Valley,AZ,USA,,,MADAR Node 53,1/19/21,
12/20/20 02:00,Sinking Springs,PA,USA,Flash,2 seconds,"Early in the am on night shift, I saw a bright green ball of light that looked like it was falling to earth. I do not think it looked l",7/31/21,
12/20/20 00:23,Albuquerque,NM,USA,Circle,10min,Bright light hovering at 9 mile hill,1/19/21,
12/19/20 22:39,St. Peter,MN,USA,,,MADAR Node 60,1/19/21,
12/19/20 22:35,Oakley,CA,USA,Formation,30 seconds,"UAP - 15 bright amber lights flying in formation over Oakley, California",1/19/21,
12/19/20 20:30,Sioux City,IA,USA,Light,1 minute,We observed a very bright white light heading west to east at a very high rate of speed. We were on the farm and had very good view of,12/23/20,
12/19/20 20:14,New Boston,NH,USA,Rectangle,20- 25 minutes,"On December 19, 2020, a UFO was observed in the vicinity of River Road in New Boston, NH.  As we were traveling down the road, we s",12/23/20,
12/19/20 15:00,North River,NY,USA,Light,15-30m,Continual light shaped orbs sightings over the past 10 years first picture evidence,12/23/20,
12/19/20 13:00,Greenville,SC,USA,Sphere,,,12/23/20,
12/19/20 09:50,Eads,TN,USA,,,MADAR Node 32,1/19/21,
12/19/20 04:51,Star Valley,AZ,USA,,,MADAR Node 53,1/19/21,
12/19/20 01:00,Limerick,PA,USA,Triangle,20 seconds,V-shape white lights moving through the sky before disappearing,12/23/20,
12/18/20 18:00,Dunedin,FL,USA,Cigar,3 minutes,White cigar shaped like the history channel F-18 incident. Zips around the sky and zooms off,12/23/20,
12/18/20 17:00,Great Barrington,MA,USA,Triangle,2 minutes,"Triangle, 40 to 50 feet long, dark grey, a point of light on each corner, 3 very bright lights clustered on bottom middle, each about 4",9/9/22,
12/18/20 16:45,Marlborough,MA,USA,Light,1 minute,"Object Emits Bright Light, Turns Off, and Quickly Leaves the Sky",12/23/20,
12/18/20 11:45,Phoenix,AZ,USA,Sphere,15 minutes,Bubble lights,12/23/20,
12/17/20 22:50,Pickering,ON,Canada,Light,2 seconds,Ball of white light travelling at incredible speed 300 ft off the ground and perfectly horizontally.,12/23/20,
12/17/20 21:15,Guayama,,Puerto Rico,Triangle,10 seconds,Standing out in front of the house just after 9:15pm chatting with the neighbor. I caught movement in the sky above me out of the corne,12/23/20,
12/17/20 18:58,Pottstown,PA,USA,Formation,2 hours,"Formation of UFOs, back and forth at high altitude.",12/23/20,
12/17/20 18:30,brampton,ON,Canada,Sphere,10 minutes,lights viewed,12/23/20,
12/17/20 16:46,Jackson,TN,USA,Fireball,10 minutes,Orange fireball slowly moved across the sky at sunset,12/23/20,
12/17/20 07:00,Kissimmee,FL,USA,Circle,,"The two balls of light in the sky would disappear together, and seperate, going from disappearing to dim to super bright.",12/23/20,
12/17/20 04:30,Quincy,IL,USA,Oval,,It disappeared behind a tree.,3/31/21,
12/16/20 23:27,Spokane,WA,USA,,,MADAR Node 37,1/19/21,
12/16/20 22:00,Ickesburg,PA,USA,Circle,1 minute 45 seconds,Two orbs outside my house.,3/4/22,
12/16/20 13:27,prosser,WA,USA,Other,00:00:45,A cloud UFO releases an object near Prosser Washington,12/23/20,
12/16/20 10:20,Naples,FL,USA,Fireball,3 minutes,Fireball,12/23/20,
12/16/20 02:20,Newington,CT,USA,,,MADAR Node 106,1/19/21,
12/16/20 00:49,Elizabeth,CO,USA,,,MADAR Node 34,1/19/21,
12/16/20,North Miami Beach,FL,USA,Circle,5 minutes,Looking at moon and planets Saturn and Jupiter. 18:30. Sun just went down. Some small low clowds. Saw two blinking lights in clouds mov,12/23/20,
12/15/20 20:56,honolulu,HI,USA,Flash,2 minutes,Stationary flashing lights - red then white then blue. Then it displayed a white light strobe effect then it zipped away really fast!,12/23/20,
12/15/20 20:35,Hilton,NY,USA,Sphere,2 minutes,Hilton NY 3 spheres,12/23/20,
12/15/20 20:00,Pearce,AZ,USA,Light,3 hours,Strange lights over several hous.,12/23/20,
12/15/20 19:00,ROCHESTER,NY,USA,Light,5 minutes,"Over 20 lights in formation in most parts non stop over Rochester, NY",12/23/20,
12/15/20 18:25,Green Valley,AZ,USA,Sphere,5 minutes,3 bright Spheres in a line north to south,12/23/20,
12/15/20 17:56,Westport,CT,USA,Circle,10 seconds,Blue circular light falling from sky,1/19/21,
12/15/20 17:30,Brookly,MI,USA,Light,2 min,"Saw a bright light hovering low over a piece of farmland, the light shifted to my right as I was facing it, stopped and then started to",12/23/20,
12/15/20 17:00,Cleveland National Forest Santa Ysabel,CA,USA,Other,,"candy cane striped hand holding a blue capsule, visible on Apple Maps at these coordinates: Lat: 33.258239 Lon: -116.776958",8/16/21,
12/15/20 14:44,Manchester,CT,USA,,,MADAR Node 151,1/19/21,
12/15/20 11:00,Chicago,IL,USA,Disk,<1min,Chicago: Shiny disk shaped UFO in daylight,12/23/20,
12/15/20 05:30,Ledgewood,NJ,USA,Light,30 seconds,Spherical green light hovering in New Jersey,1/19/21,
12/15/20 01:00,Worton,MD,USA,Changing,From the year 2017,I have seen and still have them fallowing me . I have them on video hundreds they also interfere with my phone I can send you pictures,1/19/21,
12/15/20,Stockton,CA,USA,,,Ive seen UFOs as a child and seen them in my room and memories of being on a ship tracing I remember looking at a section of the ship,1/19/21,
12/14/20 23:56,Sussex,NJ,USA,Light,A Few Seconds,Green Light moves across sky at high Speeds,1/19/21,
12/14/20 21:30,Lakeland/Winter Haven,FL,USA,Circle,Driving,Star like light moving very fast,12/23/20,
12/14/20 21:30,Kansas City,MO,USA,Other,30 seconds,Worming ribbon object moves through the kansas city sky.,12/23/20,
12/14/20 12:00,Urjala (Finland??),AK,Finland,Unknown,whole life,lava,1/19/21,
12/14/20 11:08,Earth City,MO,USA,Cylinder,1 min,"White cylinder / Stick Shape went from sitting completely still in the sky, then moving backwards, forwards then gone",12/23/20,
12/14/20 03:07,Spokane,WA,USA,,,MADAR Node 37,1/19/21,
12/14/20 00:00,,OK,USA,Fireball,,"Fireball resembing color of other meteors that night fell perfectly straight down as if it was a drop, delivery, or disguised landing.",1/19/21,
12/13/20 23:22,Show Low,AZ,USA,,,MADAR Node 74,1/19/21,
12/13/20 22:20,New York City,NY,USA,Other,One second,Green ring flew over New York city,12/23/20,
12/13/20 22:12,Hot springs,SD,USA,Unknown,50 seconds,"Fast approaching object turned into 3 green glowing bow shapes, then as it passed over the house light went out and it was metal object",1/19/21,
12/13/20 20:05,Framingham,MA,USA,Circle,4 minutes,Saw four red glowing balls moving at a high rate of speed one of them turning at a 90° angle. They were blinking in and out,12/23/20,
12/13/20 19:30,Gold Bar,WA,USA,Rectangle,3 seconds,"I think we saw a alien. It was gray and it flew right across front of our car it was the size of a coyote never touched the ground, it",12/23/20,
12/13/20 07:10,college park,MD,USA,Other,1 second,4 dots and a beam,12/23/20,
12/13/20 06:45,annapolis,MD,USA,Light,45 min,1 object north east bound disappeared then two bright objects disappeared then the last object covers a large area of the sky making n,12/23/20,
12/13/20 04:00,Bradenton,FL,USA,Triangle,5 minutes,"Big, black, triangular, no windows, no sound, no contrails and no lights untill it was about a mile away then it turn straight up glow",9/7/21,
12/13/20 01:30,Tramandaí,,Brazil,Light,30 seconds,"Red light turning into white, flying high up in the sky.",12/23/20,
12/13/20 00:00,Clearwater,FL,USA,Chevron,Seconds,Triangle chevron shaped with fixed lights flying low and fast it disappeared into thin air,12/23/20,
12/12/20 23:45,New Brunswick,NJ,USA,Disk,5 mins or so.,Saw a UFo in the sky while waiting for food delivery.,6/22/22,Yes
12/12/20 23:37,Hanover,MA,USA,,,MADAR Node 77,1/19/21,
12/12/20 21:01,Star Valley,AZ,USA,,,MADAR Node 53,1/19/21,
12/12/20 21:00,West Hempstead,NY,USA,Other,3 minutes,"We looked up in the sky and there was a square object flying above us, very slow and made no sound. Each point had a light and it was t",12/23/20,
12/12/20 21:00,New York,NY,USA,Light,5 minutes,BALLS OF LIGHT MOVING IN FIGURE 8,12/23/20,
12/12/20 16:50,Tucson,AZ,USA,Light,5 min,"Seen at first as a stationary single point of bright red light, against blue sky, then as changing colors of red, white and black",12/23/20,
12/12/20 14:10,Allen,TX,USA,Oval,5 minutes,"Amorphous and slighly oval shaped, black object seen in broad daylight...",12/23/20,
12/12/20 10:41,Ajax (Canada),ON,Canada,,,MADAR Node 41,1/19/21,
12/12/20 07:36,Flowery Branch,GA,USA,Fireball,2 to 3 mins,I woke up this morning and approximately 07:34 I opened my balcony door off my bedroom (2nd floor) and seen a bright light. At first I,12/23/20,
12/12/20 03:00,rt66,VA,USA,Disk,about 1 minute,Cannot come up with another excuse for what I saw.,3/2/21,
12/12/20 01:35,Moonachie/Little Ferry,NJ,USA,Disk,4 minutes,UFO with Bright White Lights at around 1:30am,12/23/20,
12/12/20 01:00,Bayville,NJ,USA,Fireball,10 minutes,I was standing outside on the front porch and I saw 2 fireball like objects floating through the sky flying at a fast speed. Faster tha,12/23/20,
12/11/20 19:30,Tampa,FL,USA,Unknown,10 seconds,"Nearly Invisible and silent UFO outline hovering slowly, Arch shaped.",12/23/20,
