Date / Time,City,State,Country,Shape,Duration,Summary,Posted,Images
7/31/21 22:00,Benicia,CA,USA,Sphere,1 hour,Experienced a UFO drive-by until it came down to me!,12/19/21,
7/31/21 21:30,Fremont,CA,USA,Oval,30,Blue lights and sharp maneuvers.,8/16/21,
7/31/21 21:15,El Dorado,CA,USA,Light,15 min,"Unexplained lights in the sky, moving erratically and quickly right and left, up and down",8/16/21,
7/31/21 20:45,Windsor,VA,USA,Circle,Only observed for a few m,"Exceptionally big and bright star/planet-like light briefly appears in SE sky, then vanishes, as though getting shut off.",8/16/21,
7/31/21 18:30,Staton Island,NY,USA,Other,30 Seconds,Black Icosahedron Approximately 10ft in Diameter,3/4/22,Yes
7/31/21 15:00,San Antonio,TX,USA,Circle,2hrs,4 orb white balls hovering in the sky over San Antonio TX.,8/16/21,
7/31/21 14:00,Carlsbad,CA,USA,Other,4 minutes,"I was out with a group of friends during the day in Carlsbad, CA. Its hard to describe on paper, I was siting down at a restaurant an",9/7/21,
7/31/21 10:00,Manahawkin,NJ,USA,Light,1 minute,"Sitting around a backyard campfire, we saw a bright light appear to be lower than an airplane flight path and had a much brighter/white",8/16/21,
7/31/21 03:36,Ukiah,CA,USA,Circle,38 seconds,For a whole month strange lights had kept appearing in the sky almost directly above me for a whole month.,3/4/22,Yes
7/31/21 02:00,Eaton,OH,USA,Triangle,5 minutes,I let my dog out just after 2 a.m and saw 2 bright blueish silver fast flashing triangular objects. One over the other a small distanc,8/16/21,
7/31/21 01:30,South Ozone Park,NY,USA,Light,Looking at the sky,"When I was sitting outside I've seened 6 glowing orange lights coming from JFK airport in the sky,not making any sounds all six of them",8/16/21,
7/30/21 20:30,Denver,CO,USA,Triangle,,Spinning Triangle shaped craft with lights on tips spotted in thunderstorm,12/19/21,
7/30/21 20:00,Tucson,AZ,USA,Other,20+min,"Was taking storm photos, and never saw objects, till reviewing photos I noticed a streek in the sky, not lightning, and then two green",8/16/21,
7/30/21 16:00,Greenfield,MA,USA,Cigar,2 min,"It looked like a long sliver cigar shaped cylinder flying through the air slow with the sun shining off of it, I'm still confused..",8/16/21,
7/30/21 12:51,Millerton,PA,USA,,,MADAR Node 104,8/16/21,
7/29/21 23:30,Brewster,WA,USA,Circle,ongoing,"Bright, white hot light or reflection off the sun, silent, not moving, old or circular shape.",8/16/21,
7/29/21 20:31,Portland,,USA,Other,2 minutes 30 seconds,Dark oval craft,3/4/22,Yes
7/29/21 20:15,Portland,OR,USA,,,MADAR Node 66,8/16/21,
7/29/21 16:45,Horsham (UK/England,,United Kingdom,Sphere,15 seconds,"Daytime small glinting orbs flying in formation in Horsham, UK",8/16/21,
7/28/21 23:27,Sparks,NV,USA,Light,7.2 SEC.,BLUE LIGHT SEEN OVER SPARK NV. 7/28/21,8/16/21,
7/28/21 23:13,Bakersfield,CA,USA,Flash,2 seconds,"Bright Blue light flashed in sky, left small smoke puff. No sound.",8/16/21,
7/28/21 23:00,Los Angeles,CA,USA,Light,10 seconds,"Dense, bright blue light in a long oval shape observed and then faded into a dark cloud over Silver Lake/Glendale area of LA.",8/16/21,
7/28/21 21:15,Nashville,TN,USA,Light,30 seconds,Satellites don't change direction,8/16/21,
7/28/21 10:41,Winthrop,ME,USA,Light,10 seconds,Silent white light.,8/16/21,
7/27/21 23:58,Indianapolis,IN,USA,Fireball,2 mins,First Possible Sighting of UFO: It began to move toward me!,8/16/21,
7/27/21 22:00,Benicia,CA,USA,Sphere,20 minutes,Witnessed another Orb off in the distance,12/19/21,
7/27/21 13:35,Las Vegas,NV,USA,Light,5 min,"Light seems at high altitude, hovering, then proceeding northbound.",8/16/21,
7/27/21 01:00,San Jacinto,CA,USA,Sphere,~1 minute,Large Spherical light above Idyllwild,12/19/21,
7/27/21 00:00,Dover,NH,USA,Triangle,40 min,"Red dots in triangle form, stationary, then move slowly in straight line, changing to bright white light, and disappeared.",8/16/21,
7/27/21 00:00,Dover,NH,USA,Triangle,20 minutes,"Saw triangle dotted reddish lights from my bedroom window, which began to slowly move and change to bright light, then disappeared.",8/16/21,
7/26/21 22:30,Spokane,WA,USA,Diamond,About 45 minutes,"Lots of light activity, one craft, some unexplainable events and a bonus picture from the Blue Moon of 2021",10/8/22,Yes
7/26/21 22:00,Beaumont,KS,USA,Light,15 seconds,Yellowish lights and a string of lights near Beaumont Kansas,8/16/21,
7/26/21 19:30,Phoenixville,PA,USA,Cylinder,1 minute,Tic tac crafts passing each other as on two-lane highway in blue sky with puffy clouds.,8/16/21,
7/26/21 06:46,Windham,OH,USA,,,MADAR Node 55,8/16/21,
7/25/21 20:36,Kittery,ME,USA,Circle,~1hr,"Clear sky with defined vertical split in color, 2 orbs on either side of the split line",3/4/22,Yes
7/25/21 14:00,San Diego,CA,USA,Cylinder,3 minutes,"A white cylinder, silent, not moving, then poof...gone.",8/16/21,
7/25/21 05:40,St. Thomas (Canada),ON,Canada,Light,5 - 10 seconds,Fast moving bright white object.,8/16/21,
7/25/21 03:47,Los Altos,CA,USA,,,MADAR Node 52,8/16/21,
7/25/21 00:02,Norton,MA,USA,,15 - 20 mins,Bright Light Southeastern MA,8/16/21,
7/25/21 00:00,Benicia,CA,USA,Sphere,,Witness another Orb over another neighbors home.,12/19/21,
7/24/21 22:50,Vacaville,CA,USA,Cigar,2 minutes,While driving my son noticed a black cigar shaped object above/over over the moon - i pulled over and we watched it move slowly from to,8/16/21,
7/24/21 16:55,Bothell,WA,USA,Unknown,20 sec,Shiny object moving quickly across the sky N-S Mill Creek / N Bothell WA,8/16/21,
7/24/21 16:50,Brentwood,NH,USA,Disk,Unsure,Some kind of aircraft with an oval of light to accompany it.,8/16/21,
7/24/21 14:40,San Jose,CA,USA,Sphere,Under 10 seconds,"Spherical-shaped UFO sighting in Almaden Quicksilver Park, San Jose, CA",8/16/21,
7/24/21 02:34,Wheeling,IL,USA,Light,2 hrs. Approx.,Unable to notice any shape. White light with hovering then fast jolty movement. There was only 1 light. Starless night with a full moon,8/16/21,
7/24/21 00:45,Morrilton,AR,USA,Cigar,3 min,"Mysterious, cigar-shaped aluminum floating object (with no wings or propellers) drifted directly over our car right in front of us.",8/16/21,
7/23/21 23:00,Summerville,SC,USA,Fireball,1-1.5 minutes,"My sons were in the yard. They saw this gold- illuminated, flickering but not flashing, as if made of fire. No other lights....pure gol",8/16/21,
7/23/21 22:03,Garden City,NY,USA,Disk,1 minute,"Black isosceles trapezoid shaped object moving across the sky, above the meadowbrook parkway, southbound. Red blinking lights on the bo",8/16/21,
7/23/21 22:00,Eastport,ME,Canada,Other,3 hours over three nights,"Five spoked object like a wheel with multiple bright, red, green, white, blue, & yellow flashing lights along the spoke structures.",8/16/21,
7/23/21 21:15,Bonita Springs,FL,USA,Triangle,5 min,"Heard a sound not far above us. Looked up, saw a huge ship hovering above almost still, bright light from the center, just watching",4/22/22,
7/23/21 19:00,Benicia,CA,USA,Disk,,"Over 100 ships/crafts came and scattered all over the sky and myself, wife and 3 neighbors watched them for an hour and 10 mins.",12/19/21,
7/23/21 17:27,Allentown,PA,USA,,,MADAR Node 177,8/16/21,
7/23/21 05:30,Denver,CO,USA,Unknown,1 mile,Grasses laid down in weird patterns for over a mile,8/16/21,
7/23/21 00:00,Singatse Peak,NV,USA,Teardrop,3 hours,"Urgent: recorded on public fire camera, footage available 12 hours only.",8/16/21,
7/23/21,Kansas City,KS,USA,Circle,30 seconds,Saw 2 firey orbs moving iand hovering n unison,8/16/21,
7/22/21 21:30,Point Pleasant Beach,NJ,USA,Circle,2 minutes,"Green circular object over Point Pleasant Beach, NJ",8/16/21,
7/22/21 21:15,Boulder,CO,USA,Other,2-3 minutes,"I saw a very brightly lit, white object, roughly the shape of an airplane, but with no visible wings or rotor, moving southward.",3/4/22,Yes
7/22/21 21:05,Casco,ME,USA,Teardrop,~10 Seconds,"Round Yellow UFO over Sebago Lake, fish abduction? The next night, USO.",8/16/21,
7/22/21 08:00,Punta Gorda,FL,USA,Cylinder,4 hours,Multiple Tic tac shape flying objects in a few hours.,8/16/21,
7/22/21 01:55,Seattle,WA,USA,Other,1 minute,"Saw like a helicopter type thing going low over I-5 but I really couldn't tell if it was a helicopter, that is why I'm saying a helicop",8/16/21,
7/21/21 23:28,Conyers,GA,USA,Chevron,4seconds,"Saw a very bright flash going from South to North that lasted for seconds. Right before this, a plane was circling to land at Atlanta-H",8/16/21,
7/21/21 22:30,Benicia,CA,USA,Sphere,,"Sphere of light appears, changes direction and position, changes size, repeats.",12/19/21,
7/21/21 21:30,Malvern,OH,USA,Other,,"4 solid L shaped blushes green lights, I have the picture",8/16/21,
7/21/21 21:24,Napavine(?),WA,USA,Triangle,60 seconds,White sparkling lights in a triangle stationary in the sky,8/16/21,
7/21/21 21:00,Elmira,NY,USA,Cigar,40 minutes,"Tic-Tac shaped, wingless and no propulsion in the evening.",8/16/21,
7/21/21 20:00,Macon,GA,USA,Formation,15 minutes,"They came from the East in tight formation at first, grouped together, they were black circular objects yet shining due to the setting",8/16/21,
7/21/21 05:30,Springfield,OR,USA,Circle,About 1 minute,"A stationary red circle moves down straight in sky, emits light, stops briefly and moves in a perfect straight line to its left.",8/16/21,
7/21/21 05:27,Star Valley,AZ,USA,,,MADAR Node 53,8/16/21,
7/21/21 03:01,Richboro,PA,USA,Circle,Ongoing,Perfectly circular formation of even pure white light of intense luminosity,8/16/21,
7/20/21 22:30,Spokane Valley,WA,USA,Other,2-3 minutes,ISS bracketed by 4 moving objects that looked like regular stars..,8/16/21,
7/20/21 09:18,Van Horn,TX,USA,Unknown,09:18,UFO sighting during Blue Origin launch.,8/16/21,
7/19/21 22:25,Calumet Park,IL,USA,Light,5 minutes,Rapid object with red lights hovered at high altitude over Chicago.,8/16/21,
7/19/21 22:00,Winter,WI,USA,Triangle,1 hour,Triangular shaped brilliant light above roof,8/16/21,
7/19/21 22:00,Derry (Ireland),,Ireland,Circle,1 minute,While in aircraft,8/16/21,
7/19/21 19:35,Philadelphia,PA,USA,Circle,3- 5 seconds,Several round white object sight near my flight traveling in opposite direction at a high rate of speed.,8/16/21,
7/19/21 14:48,Star Valley,AZ,USA,,,MADAR Node 53,8/16/21,
7/18/21 22:00,San Marcos,TX,USA,Other,4-6 minutes,A long flickering shape went across the sky slowly and as it got out of view other lights started to appear closer than the original,3/4/22,
7/18/21 17:45,Staten Island,NY,USA,Other,approx.20 sec,"On Sunday, July 18, 2021, I was sitting on Midland Beach on Staten Island, with my back to the water. I was gazing at the different la",8/16/21,
7/18/21 04:00,Reading,PA,USA,Light,5 seconds,WHITE DOT IN PA,8/16/21,
7/18/21 01:00,Fort Wayne,IN,USA,Unknown,Around 3ish seconds,Saw A Light Flash around before a flash circled with another,8/16/21,
7/18/21 01:00,Shoreview,MN,USA,Oval,31 seconds,Lights hovering,12/19/21,
7/18/21 00:25,Estes Park,CO,USA,,,MADAR Node 156,8/16/21,
7/17/21 23:05,Dallas,OR,USA,Unknown,10 seconds,It was a star like object with a quick back and forth in a zigzag type of way then it disappeared.,8/16/21,
7/17/21 23:00,Wyoming,MN,USA,Light,10 min,"One light, morphed into two bright balls of light.",8/16/21,
7/17/21 22:30,Spokane,WA,USA,,20 min,,8/16/21,
7/17/21 20:30,Clifton,NJ,USA,Cone,9 days (most days sunset,"Black/silver cones, dome top, red(0/20mph)/white(60mph). Aliens use invisibility cloaks are illuminated by light above/dim light behind",8/16/21,
7/17/21 20:30,Clifton,NJ,USA,Other,10 days+,"1 blue line, 2 red glowing domes. Almost transparent entities (dim direct light behind them, illuminated by direct light above them.)",8/16/21,
7/17/21 00:00,Normandy Park,WA,USA,Changing,>20 minutes,"One section of the sky lit up over the sound between Vashon island and Normandy park, the bright light subsided a bit and an object app",8/16/21,
7/16/21 23:45,Odessa (Starkey Ranch),FL,USA,Sphere,15 seconds,3 spherical objects flying in formation,3/4/22,
7/16/21 23:00,Hutto,TX,USA,Circle,2 min,Hutto tx. White silent orbs 2nd sighting,8/16/21,
7/16/21 22:30,Claremont,NH,USA,Light,20 mins,Circular white light instant acceleration defy forces of gravity no sound Claremont self storage Washington street,8/16/21,
7/16/21 14:10,smiths falls,ON,Canada,Oval,unknown,Clear photographic evidence of a red/orange missile shaped craft carrying a large being,8/16/21,
7/16/21 05:40,Homestead,FL,USA,Fireball,1 minute,Silent Ball of Light going at fast speeds.,8/16/21,
7/15/21 21:30,Austin,TX,USA,Light,30 seconds,Flying Object in Space that sped away quickly.,8/16/21,
7/15/21 21:00,Tellico plains,TN,USA,Triangle,5 minutes,"I saw a black triangle three times, once over my house and once over a field and once following me home.",3/4/22,
7/15/21 20:45,Colorado Springs,CO,USA,Flash,5 sec,"I was sitting on my sofa watching TV and the patio slider door was to my left. In my peripheral vision, I saw a very large, yellow, br",8/16/21,
7/15/21 19:53,Eagle Nest,NM,USA,Light,15 seconds,Bright light flying in sky,10/19/21,
7/15/21 16:00,Khabarovsk,Khabarovsk Krai,Russia,Circle,probably 15 minutes.,"3 objects, one smaller than others. 2 giant circles had purple lights on the edges. Perhaps for hypnosis.",9/9/22,
7/15/21 06:00,Shoreline,WA,USA,,3 minutes,"I know this is not UFO related BUT I really, really got scared by hearing some woman's voice from somewhere saying something like It's",8/16/21,
7/15/21 01:30,Cambria,CA,USA,Light,5 minutes,Strange multiple colors lights,8/16/21,
7/14/21 23:30,Albuquerque,NM,USA,Triangle,Approximately 2 hours,I went outside to smoke a cigarette and looked up to see all this happening. Tonight approximately 00:00 I saw the same thing I will se,8/16/21,
7/14/21 23:00,Clifton Forge,VA,USA,Fireball,10 seconds,Bright orange fireball loiters for 4 hours over rural town.,8/16/21,
7/14/21 13:30,Waymansville,IN,USA,,3 hours,Lost time,3/4/22,
7/14/21 03:00,Bishopville,SC,USA,Light,20 minutes,Saw a star looking object darting back and forth between other stars at a rapid speed.,9/7/21,
7/13/21 23:00,Fort wayne,IN,USA,Other,Around 2 hours,"Me and my Cousin saw 3 UFOs. Its Dangerous in my opinion, ive Seen multiple in the last month all around Fort Wayne, apart from this.",8/16/21,
7/13/21 21:52,State College,PA,USA,Unknown,6 minutes,Bright green flashing light in the sky hovering in a weird shaped craft. Incredible speed as the craft zoomed away.,8/16/21,
7/13/21 21:30,Winston-Salem,NC,USA,Light,38 second video footage,moving lights came across left side of sky changed direction and disappeared,12/19/21,
7/13/21 18:00,,Hertfordshire,United Kingdom,Changing,5 minutes,The biggest spacecraft maybe mothership,4/22/22,
7/13/21 03:30,Tonopah,AZ,USA,Light,3 hours,Seen about 10 ufos in Tonopah Arizona.,9/7/21,
7/12/21 23:00,Pacific,WA,USA,Chevron,15 seconds,"I saw a large 300 sq ft Chevron shaped object in the sky, very bright white in color, it took off at an extremely high rate of speed fr",8/16/21,
7/12/21 22:16,Lewes,DE,USA,Triangle,4 seconds,Triangle shape craft with lights at points and center made low turn over tree line and disappeared into trees.,8/16/21,
7/12/21 22:00,Kansas City,MO,USA,,20 minutes,Large beam/halo of light hovering in the sky,8/16/21,
7/12/21 09:40,Alton,IL,USA,Other,Leaving work,I was looking at the moon we had that night and as I looked down to the pictures I took I seen something I didn't see in the sky nor in,8/16/21,
7/12/21 01:00,Reno,NV,USA,Light,Ten minutes,3 bright lights not connected all in a row,4/22/22,
7/12/21 00:53,Snohomish,WA,USA,Changing,2 min,"Please see my video on YouTube (I can send original too if needed). The video is unedited. I don't monetize, but post for friends. I",8/16/21,
7/11/21 23:30,Sultan,WA,USA,Triangle,2mins,Stepped outside around 11:30 pm was looking south east and saw a faded triangle shape light fly from west to east at a very high speed,8/16/21,
7/11/21 19:15,"Happy Valley Goose Bay, Labrador (120 kms away at cabin)",NF,Canada,Changing,7:15 PM-8:25 PM Stealtcam,various pictures taken with stealth cam showing one object breaking into two objects sending light beams to the ground then going back,9/9/22,Yes
7/11/21 18:08,Toowoomba (Australia),,Australia,Circle,15 minutes,It is bright and circular it moves slowly an slowly rotates and has three light on the bottom of the craft My address is ((deleted)),8/16/21,
7/11/21 13:48,Corbett,OR,USA,Light,Picture taken phone,Tic tac white round spots in sky over Crown Point from a picture taken from phone while driving,5/31/22,Yes
7/11/21 08:30,Fremont,CA,USA,Oval,20mins,Oval shaped looked like a tic tac lighting over it couldnt see it clearly,8/16/21,
7/10/21 22:00,Pawtucket,RI,USA,Formation,15 minutes,Strange Silent Orbs of Light in Formation,11/15/21,
7/10/21 21:30,Mustang Island,TX,USA,,3-minutes,"Orb grouping, along with oblong shaped object, lit in white light",8/16/21,
7/10/21 21:30,Los Angeles,CA,USA,Triangle,15-20 minutes,"Bright yellow lights shifting from triangle formation to line formation, lasted about 20 minutes seen west of USC.",9/7/21,
7/10/21 21:20,Superior,WI,USA,Light,10 seconds,Objected moved from west to east over Lake Superior and disappeared.,8/16/21,
7/10/21 21:15,Rehoboth Beach,DE,USA,Sphere,5-7 minutes,6 orange globes in the night sky over Rehoboth Beach.,8/16/21,
7/10/21 21:00,Kas Antalya (Turkey),Antalya Province,Turkey,Formation,Picture,Noticed in a picture,3/4/22,Yes
7/10/21 14:00,Lockhart,TX,USA,Rectangle,3 min,I noticed a iridescent line in the sky changed the contrast in photo and realized there was something hidden in plain sight,10/19/21,
7/10/21 12:00,Frederick,MD,USA,Other,10 minutes,Black object hovering in daytime sky,8/16/21,
7/10/21 10:15,Westerly,RI,USA,Triangle,12 seconds,"We were sitting in the back yard by the fire pit talking. It was a clear night sky. After about an hour, I happened to look up and saw",8/16/21,
7/10/21 09:20,Indianapolis,IN,USA,Circle,9:28,2 lights/No Sound/ 45% between them. Hovering over neighborhood,8/16/21,
7/10/21 03:30,Kenton,OK,USA,Triangle,40 seconds,"Equilateral triangle with a dim stationary light in each corner with the center being translucent, as stars were seen in the center",8/16/21,
7/10/21 00:59,Oklahoma city,OK,USA,Other,5 to 10 seconds,It flew right in front of me and disappeared,5/31/22,
7/10/21 00:15,Sarasota,FL,USA,Disk,8 days,Many UFOs gathering in the night sky above Sarasota. Noticed 1 on 7/10/2021 and the sky has been full of them since.,8/16/21,
7/9/21 22:42,Rathdrum,ID,USA,Light,1,Small floating light/disk. Hovered for about a minute getting brighter and duller. It then started to move further away and disappeared,10/19/21,
7/9/21 22:14,Galt,,,Circle,3 to 4 minutes,Saw orbs circular bright lights forming triangle shapes .. darting away at light speed,6/22/22,
7/9/21 21:30,Brewster,MA,USA,Light,Several minutes,White dots moving across the sky.,8/16/21,
7/9/21 12:48,Deep River (Canada),ON,USA,,,MADAR Node 59,8/16/21,
7/9/21 08:00,Denver,CO,USA,Oval,15 mins,UAP,8/16/21,
7/9/21 06:10,Jonesboro,AR,USA,,,MADAR Node 143,8/16/21,
7/8/21 23:00,Superior,WI,USA,Circle,14 minutes,((NUFORC Note: Witness provides no detailed information about sighting. PD)),8/16/21,
7/8/21 23:00,Superior,WI,USA,Circle,14 minutes,"On this date and time my children and I seen a green light in the southern sky at a 35 degree angle from our visual , than it stoped fo",8/16/21,
7/8/21 22:00,Moorefield,WV,USA,Light,25 minutes,"Multiple non flashing lights (some were solid blue, some were red and others were kind of white) flying in all different direction all",8/16/21,
7/8/21 21:22,Richardson,TX,USA,Fireball,3:00,Large as the setting sun round orange molten sphere moving through the sky,8/16/21,
7/8/21 20:45,Commack,NY,USA,Triangle,4 min,Black triangle with 3 light in each corner and Orange middle hue hovering approx 200ft off ground,4/22/22,
7/8/21 19:24,Flatwoods,KY,USA,Changing,About 2-3 minutes roughly,I saw 6 orange orbs in the sky disappearing and reappearing in different areas. The orbs would go vast distances and stop on a dime.,3/4/22,
7/8/21 13:00,Rudolph,WI,USA,Circle,45 minutes,Working on boat 07/08/2021 around 13:00 sky was starting to cloud up .sun was behind a cloud.noticed circle white in color . Moving sid,8/16/21,
7/8/21 10:30,Sarasota,FL,USA,Triangle,~1 minute,Triangular craft silently glided right over my head when i was in the car,8/16/21,
7/8/21 08:59,Royal Palm Beach,FL,USA,,,MADAR Node 76,8/16/21,
7/8/21 03:16,Bremerton,WA,USA,Flash,10 minutes,Military jet side swiped by bright light from cloud cover it,8/16/21,
7/8/21 03:00,Surrey (Canada),British Columbia,Canada,Circle,10 MINETS,I WAS IN MY YARD 5 MINETS LATER IT SHINED A BEAM OF LIGHT ON ME IT WAS THERE 10 MINETS,3/4/22,
7/7/21 23:00,Oroville,CA,USA,Light,15 minutes,I was talking to my co-worker about seeing a lot of UFOs lately when I pointed out a star that was moving fast. It flew right at an air,8/16/21,
7/7/21 22:30,Paris,TX,USA,Circle,4-5 minutes,dancing white dot high in eastern sky,8/16/21,
7/7/21 13:40,Tacoma,WA,USA,Other,2 minutes,"July 7 2010, About 4:00 Pm Tacoma Wa. White silk sheet looking thing flapping in the wind, but moving through the sky using a swimmi",8/16/21,
7/7/21 13:05,Green Mountain,NC,USA,Other,Aprox 2 interv of 30 sec,Heard Ham-radio sounds,4/22/22,
7/7/21 12:45,El Centro (east of),CA,USA,Cigar,2 minutes,"Strange ""blimp-like"" object seen hovering over desert where military practice.",8/16/21,
7/7/21 01:23,Moscow,ID,USA,Light,30 min,"Object moving across sky west to east that was changing colors: red, yellow, green, blue, white.",7/31/21,
7/7/21 01:00,Natchitoches,LA,USA,Circle,4 hours,Ufo sightings and Mufon is also investigating.,8/16/21,
7/7/21 00:17,Vineland,NJ,USA,Circle,2-4 minutes,"My boyfriend and I were outside when we saw a red light in the sky. The light was bright, did not move until it shot upward & vanished.",8/16/21,
7/6/21 22:44,calgary,AB,Canada,Egg,within seconds,Possible objects in sky,6/22/22,Yes
7/6/21 21:40,Stonington,CT,USA,Oval,about 12 minutes,At about 9:40 for about 12 minutes I was playing with some friends and saw a oval shape craft moving in the sky that soon disappeared.,3/4/22,
7/6/21 21:15,Eldorado Hills-Placerville (Hwy 50,CA,USA,Triangle,30-60 seconds,"It appeared just as I crested over a hill, blatent and moving slowly and effortlessly just above the tree line.",3/4/22,
7/6/21 19:44,Chapel Hill,NC,USA,Other,3 film clips approx 6 min,"A friend of mine sent me 3 film clips of odd plasmas caught in his security cam. Almost seems like one group attacking another, sounds",9/9/22,
7/6/21 18:00,Cohasset,MA,USA,Other,45 mins,"UFO report Hello, I have seen several UFOs over the past few days. I typically use my energy to call them in. They come and I just tak",8/16/21,
7/6/21 16:04,Kansas City,MO,USA,,,MADAR Node 40,8/16/21,
7/6/21 11:40,Lebanon,OR,USA,Circle,30 minutes,Round orange shape that was bright and would have no light to it for minutes at a time Nd then eventually just was gone. Seemed to have,8/16/21,
7/5/21 22:00,Duxbury,MA,USA,Circle,,"It was a bit low and a bit behind the clouds but it was moving very slow and I knew that no plane can go that slow, it flew off after.",12/19/21,
7/5/21 22:00,Clinton,IA,USA,Other,2 minutes,Single white unidentified object detected in residential area.,8/16/21,
7/5/21 20:38,Walnut Creek,CA,USA,Changing,2 minutes,White rotating elongated object with ability to shape shift.,8/16/21,
7/5/21 13:00,Denver,CO,USA,Light,30 minutes,"Standing in the backyard, my house guest asked me to take a look at an object in the sky. It looked like as balloon at the height of ab",8/16/21,
7/5/21 10:00,Pueblo,CO,USA,Unknown,Still durating,"I feel our bodies are taken by E.T'S AND ALSO THE MIND OR BODY MAY ALSO BE POSSESSED BY PAST SPIRITS OF THE EVIL OR WHAT NOT SEX, AND M",8/16/21,
7/5/21 07:45,Tuscaloosa,AL,USA,Light,45 sec.,I have physical pictures of proof,8/16/21,
7/5/21 02:53,Detroit,MI,USA,Circle,1min,Saw in the sky three star sized lights moving rapidly and smoothly in a reverse triangle formation. Checked my phone compass and looks,8/16/21,
7/4/21 22:55,Newport News,VA,USA,Light,2 minutes,Was watching fireworks in my neighborhood when I noticed two distinct red lights. They moved from SW to NE. I estimate the distance bet,8/16/21,
7/4/21 22:00,Decatur,IL,USA,Circle,,Orange sphere shaped with halo of light around it,8/16/21,
7/4/21 22:00,Lincoln,MT,USA,Rectangle,15 minutes,"Rectangle Hovering Craft Over Lincoln, MT",8/16/21,
7/4/21 22:00,Fayetteville,PA,USA,Sphere,,3 UFOs flew over my house and I filmed the 3rd,12/19/21,
7/4/21 22:00,Peyton,CO,USA,Sphere,at least 4 hours,Bright cloud-emitting orb seen for over 4 hours in Colorado. ((NUFORC Note: Source of report is experienced astronomer. PD)),8/20/21,
7/4/21 21:50,West Jordan,UT,USA,Changing,51/2 minutes,Three witness White and red sphere that changed shapes near army base,8/16/21,
7/4/21 21:47,Crystal Lake,IL,USA,Light,10 minutes,I witnessed a bright light zoom quickly from the west that stopped perfectly stationary over Crystal Lake IL during the fireworks show,8/16/21,
7/4/21 21:00,San Juan Capistrano,CA,USA,Changing,> 1 hour,Object stood still also moved all directions turning to fuzzy ball then back.,10/19/21,
7/4/21 20:33,South Mills,NC,USA,Oval,1 second,Object moving with great speed noticed on video playback,8/16/21,
7/4/21 20:10,Phoenix,AZ,USA,Changing,2-3 min,3 bright sphere / orb objects over Phoenix Metro area,8/16/21,
7/4/21 20:00,Duxbury,MA,USA,Circle,15 seconds,"Me and sister saw, didnt know what it was and it shot back into clouds.",4/22/22,
7/4/21 19:25,brooklyn,MI,USA,Cigar,30 seconds,"flying and hovering craft from southwest moving north east, craft disappeared after approximately 30 seconds, flight was captured on fi",8/16/21,
7/4/21 17:00,Ocean city,NJ,USA,Light,.5 hour,Lights in sky on July 4th. ((Starlink satellites???)),8/16/21,
